attempt,status,description,strategy_sha256,days,total_return,annual_return,sharpe,max_drawdown,mean_turnover
0063,discard,Adaptive oscillator standardized surprise: RSI14 more than1.5 prior60-observation standard deviations below mean enters; mean recovery exits or20session cap.,f2b793b1ef8e5f583bb78a5f1c5131a19850cdd6678c5bbb45f280f629ba84fa,726,0.04356111919700467,0.014910387082228027,0.19037427121092226,0.19114163046459587,0.03305785123966942
0064,discard,"Slower oscillator reversion: RSI28 below35 enters,above55 exits or20session cap; tests less sensitive oversold regime measurement.",4e1e460f3965df343483923e99059141a90d58bc894f6bf44bf5964873fc7bcf,726,0.06946119468787781,0.023583789011815792,0.3369032371516519,0.10224741493691758,0.011019283746556474
0065,discard,Drawdown recovery confirmation: index8% below prior60 closing high and positive3-day momentum enters; recover SMA20 or20session cap exits.,bdb1e8023263ed8d4e725215fe7a33d12a27daf8cda3204e530725ce09e354fd,726,-0.0324368818629881,-0.011380481879860072,-0.06882626939046387,0.18813336623754984,0.1046831955922865
0066,discard,"Train-only nonlinear regime model:20 bootstrap regression trees,depth2,minleaf60,5 random features per node,4 quantile splits,seed711,zero-shrunk leaf predictions. Target1-session training return; entry>5bp,exit<0;tree agreement filter=False. No date features or validation fitting.",23a12c17007bc937e4403e9f84a636efe006af610a5df653d97996331c3b696e,726,0.2243454360327466,0.07278358757537551,0.5905398775193565,0.15158735557237912,0.21212121212121213
0067,discard,"Train-only nonlinear regime model:20 bootstrap regression trees,depth4,minleaf60,5 random features per node,4 quantile splits,seed711,zero-shrunk leaf predictions. Target1-session training return; entry>5bp,exit<0;tree agreement filter=False. No date features or validation fitting.",049bd2035401a1b40f209bd331c863c97ab2a9166bb9f9f1afce1bfe1d2505eb,726,0.15660941172218834,0.05179858250331604,0.4359451723350694,0.13050921747752664,0.25068870523415976
0068,discard,"Train-only nonlinear regime model:20 bootstrap regression trees,depth3,minleaf120,5 random features per node,4 quantile splits,seed711,zero-shrunk leaf predictions. Target1-session training return; entry>5bp,exit<0;tree agreement filter=False. No date features or validation fitting.",1a6ffd6723adafbf4e52628ddc6e87b26f1c57a3de16a1b0f633d2088a5cf066,726,0.08229282020668305,0.027830090168445176,0.25631445346473325,0.16718192384257857,0.3002754820936639
0069,discard,"Train-only nonlinear regime model:20 bootstrap regression trees,depth3,minleaf60,5 random features per node,4 quantile splits,seed711,zero-shrunk leaf predictions. Target5-session training return; entry>25bp,exit<0;tree agreement filter=False. No date features or validation fitting.",4e9bca7b28f0dc3bb9c8eb3c5bb4909ceba698fafdd4afe13c5256a2cc1f36e4,726,0.12316728357603113,0.04114122205595572,0.39285986053140554,0.16652060108886824,0.09090909090909091
0070,keep,"Train-only nonlinear regime model:20 bootstrap regression trees,depth3,minleaf120,5 random features per node,4 quantile splits,seed711,zero-shrunk leaf predictions. Target5-session training return; entry>25bp,exit<0;tree agreement filter=False. No date features or validation fitting.",3c7a011d20c64e45909bb6b9bc72b7e1382065e2cc19b98348d4ab73da20b9d9,726,0.31109856237248135,0.09858104625969988,0.7707522852053549,0.15569185450322587,0.09917355371900827
0071,discard,"Train-only nonlinear regime model:20 bootstrap regression trees,depth3,minleaf60,5 random features per node,4 quantile splits,seed711,zero-shrunk leaf predictions. Target1-session training return; entry>5bp,exit<0;tree agreement filter=True. No date features or validation fitting.",54edaf04f53d2844d8687c9c334740480528a3b9a9ea0d1b4cb67c98e00649d5,726,0.24060794302270327,0.07770835889787353,0.6345634444366205,0.12809350691750843,0.22589531680440772
0072,discard,Five-day forest agreement check: require at least60% positive trees for entry; otherwise retain20-tree depth3 minleaf120 model.,59391be6a8b20fe89546d014c20608319775b27015099e20327f8efb3dc9a17b,726,0.31109856237248135,0.09858104625969988,0.7707522852053549,0.15569185450322587,0.09917355371900827
0073,discard,Five-day forest cautious entry: double expected-return hurdle from25bp to50bp to emphasize stronger training-learned opportunities.,ac035779391b9f43d8eefc6d7af76dfce476f68e46b59f967cba14111aa81ec1,726,0.07871515643135085,0.026649472581960154,0.3103619429441073,0.09663035304976653,0.04132231404958678
0074,keep,Five-day forest broader entry: lower expected-return hurdle from25bp to10bp; investigate missed low-amplitude opportunities.,3cf0d148029295284fd0261e1e7277e7420cf026baded07b501ebb5cdb6bea85,726,0.5480550957994492,0.16379443373695057,1.0013577224619412,0.16340042007577626,0.26170798898071623
0075,discard,Five-day forest stronger support: raise minimum leaf size from120 to180 while holding other model choices fixed.,db1c4e184db534dd46a28641b49a3ca0f52a74953dc202c035db59a2c8230c37,726,0.06822423622773521,0.023172694711531605,0.24415516234360934,0.23276704941209247,0.09917355371900827
0076,discard,"Signal complementarity: union allocation combining train-only five-day forest and RSI14 30/55 reversal with20-session cap; independently tracked states,maximum100% index exposure.",8b3011f0cdc76caba41925d8699c4f1f1088385723448d3575553fae3975d154,726,0.37863414741900625,0.11790216182589885,0.8404424152963551,0.16427025287834718,0.06887052341597796
0077,discard,"Signal complementarity: equal allocation combining train-only five-day forest and RSI14 30/55 reversal with20-session cap; independently tracked states,maximum100% index exposure.",6a4f13046fc2f368bcdd2dbe4b00f592cdbe471e1aff833c00f63759ecc52c02,726,0.2922890873360544,0.09308459097092814,0.9338074705233204,0.08887177683113834,0.060000943994760435
0078,discard,"Forest stability check: expand20 to60 trees with the same seed711 sequence,5-session target,depth3,minleaf120 and10bp entry; reduce bootstrap Monte Carlo variation without seed selection.",86106e7b9a30282deb74252c1af7f7549c8f739ee6eb1cbed73dca20c3bc35da,726,0.4574664110069062,0.13968878640096838,0.8808362065909991,0.1605866893720097,0.26170798898071623
0079,discard,"Forest stability check: expand20 to100 trees with the same seed711 sequence,5-session target,depth3,minleaf120 and10bp entry; reduce bootstrap Monte Carlo variation without seed selection.",067a4a4b2a446cf062e634a7132c0380a6a1f237c305bae2a2646bfaaf6e14a5,726,0.29195142146227115,0.09298544336444614,0.6184189834738455,0.231997775814895,0.24242424242424243
0080,discard,"Forest structural sensitivity: depth2, retaining minleaf120,5-day target and10bp entry; test simpler versus more conditional rules.",7ad6e6d6b89f0158d5ee7b9bfe73010ef12f11ecaaf9fd81115281d99bfa2429,726,-0.06365302753982038,-0.022570360271089274,-0.03280814351247951,0.22506172397544788,0.19834710743801653
0081,discard,"Forest structural sensitivity: depth4, retaining minleaf120,5-day target and10bp entry; test simpler versus more conditional rules.",18c3b0e9e9d2661b8730ec9d82d888175e8a7191c6e31fbb792e4d579aef289c,726,0.2949929078694822,0.09387789468594021,0.6018117668658988,0.175586041085405,0.25895316804407714
0082,discard,"Forest forecast horizon sensitivity: train-only3-session compounded returns,retaining20trees/depth3/minleaf120; entry hurdle remains2bp per forecast day.",ac6b294f280836a864d7e42fac9a01b7100f985d8a583bf4ce7728fd31cd4f09,726,0.18127786137155,0.059531663426374504,0.427771907132435,0.1852598513106023,0.2809917355371901
0083,discard,"Forest forecast horizon sensitivity: train-only10-session compounded returns,retaining20trees/depth3/minleaf120; entry hurdle remains2bp per forecast day.",1b02143f3ade19361f5c26c8c2b73b3f0171cfd20992465923dd8a0365556dee,726,0.24114904064741927,0.07787149287212713,0.5598673407141438,0.21965178180963763,0.1322314049586777
0084,keep,Combine broader-entry forest champion with RSI reversal viaunion; both states tracked independently and maximum exposure100%. Unlike prior ensemble this uses10bp forest entry.,25bb4a7c06d294485e7eb16e5ca573f475cbda6d7256aa6f9b80a3c374a853cb,726,0.5876591266133477,0.17404390878788423,1.0180235056443878,0.16772982417386717,0.21763085399449036
0085,discard,Combine broader-entry forest champion with RSI reversal viaequal; both states tracked independently and maximum exposure100%. Unlike prior ensemble this uses10bp forest entry.,7dfd4a19375a1ca4561e16b6963d8557c6383bfcd50f26b845cf2e49c1d0ee6a,726,0.40799420527968144,0.1261090958391733,1.101890899223091,0.1169346462754467,0.1417017872661065
0086,discard,Feature ablation on forest+RSI union: remove native volume ratio; test whether model survives without volume-source conventions.,c42a1efee339ae9324f530083ca44545ec27501c7161379c81bb1304749a7578,726,0.30071347579072083,0.09555275778314587,0.6360669244443532,0.17997935244405505,0.18181818181818182
0087,discard,"Feature ablation on forest+RSI union: remove intraday OHLC/gap/IBS terms,retain close-based and relative-volume features.",d170aacd0f8be755481bfcbc928c037599fb5c4ef80910d5490109b908bf428c,726,0.06423545046084422,0.021844929448552097,0.2133811106494685,0.26673509624287384,0.14049586776859505
0088,discard,Feature compression on forest+RSI union: use seven simple return/MA-deviation features only; retain separate RSI reversal sleeve.,5d3f587fd6974273a40e634e41afa64b55d8868a3a58e1e8244025cc9808602b,726,0.21045149562621446,0.06854214600713116,0.45016842968494053,0.29483460753971114,0.1184573002754821
0089,discard,Add drawdown context to forest+RSI union: include current close relative to20/60/120-session closing highs; all features causal.,2e84f141193aa5fd0cb7be42a089c25c20027098bccf07104daaf5719c10e18d,726,-0.002174510973048327,-0.0007553253708869612,0.0881939710340588,0.22629438786916067,0.09917355371900827
0090,discard,"Contiguous-block bootstrap forest+RSI union: resample5-session feature/label blocks instead of independent rows,retain20 trees/depth3/minleaf120/5-day targets. Targets computed inside training before resampling; no synthetic cross-block returns.",de2ccb5948ce14e519a12722e1718801a0a8e09e769b6b7cfbe7943dac5101da,726,0.484053360823542,0.14686263221007279,0.900609802916392,0.25897400778416546,0.19559228650137742
0091,discard,"Contiguous-block bootstrap forest+RSI union: resample20-session feature/label blocks instead of independent rows,retain20 trees/depth3/minleaf120/5-day targets. Targets computed inside training before resampling; no synthetic cross-block returns.",7bff50c5964554e0c3d255ff8ab948a97d41b60d71c397ae72f2d0aad88375f9,726,0.2808622339511091,0.08971991999521567,0.5900891690789768,0.22236935705838534,0.1763085399449036
0092,discard,"Contiguous-block bootstrap forest+RSI union: resample60-session feature/label blocks instead of independent rows,retain20 trees/depth3/minleaf120/5-day targets. Targets computed inside training before resampling; no synthetic cross-block returns.",90d5f0bf63973a5f27becfb68520ff73e97e8c2fe613db9aa806bcdb4f70376a,726,0.39343613156800616,0.12205383095473854,0.8843562413271969,0.1373849233553568,0.1487603305785124
0093,discard,"Train-only threshold calibration for forest+RSI: first65% training prefix fits forest,remaining training suffix selects entry/exit from8 cost-aware candidates with purged5-session gap,then refit forest on all train; no validation tuning inside fit.",8dddd9f73f3e8cb39731974fe89a2dbd73f70a0dfff1fb3e6911a399068c157b,726,0.44996972720234285,0.13765056420653754,0.8001977337937966,0.22288866876126312,0.27823691460055094
0094,discard,"Train-only threshold calibration for forest+RSI: first80% training prefix fits forest,remaining training suffix selects entry/exit from8 cost-aware candidates with purged5-session gap,then refit forest on all train; no validation tuning inside fit.",c6b9a85758509e6e30fb9d1ff0b93157806e023bb84f222df46bb7d4c9e73074,726,0.42836554377742275,0.13173799237257744,0.8726494583855648,0.19327495972081443,0.05234159779614325
0095,discard,"Train-only directional forest+RSI union: classify sign of5-session training returns rather than estimate magnitude; signed-vote mean>.1 entry,negative exit; no reweighting of final reward.",fcd32486ea3f7246c3bd27dc7f1c55f6504100e30ac63434dd9798308e8528ac,726,0.23343095357562804,0.0755401808785392,0.6419490166870612,0.13924021923005958,0.03581267217630854
0096,discard,"Train-only directional forest+RSI union: classify sign of10-session training returns rather than estimate magnitude; signed-vote mean>.1 entry,negative exit; no reweighting of final reward.",8c9c85336e54b61d3c61723f08b988b29b057686328ee5c9e56d75e8b4a16892,726,-0.055288671130575895,-0.01954843968214337,-0.014737949698768052,0.29207986974087263,0.04132231404958678
0097,discard,"Train-only log-return forest+RSI: fit log(1+five-day return),same10bp forecast hurdle; tests multiplicative-growth target representation.",b36e4d9901673a9147017854e1bc777eddaeb07ede525a01e6eae91e4445994c,726,0.45598681299911825,0.13928705168611777,0.896950888516028,0.1634388743595585,0.21763085399449036
0098,discard,Train-only downside-sensitive forecast: target five-day return minus its squared negative part times5; unchanged final net-return reward and drawdown constraint.,80cfa019ce2603214a75d77ffb0f1e1ece0d9a5f83cf244c96e3aa1ad1ce9939,726,0.21332293777075795,0.06942131476684033,0.6098172848292684,0.2014171139635078,0.09641873278236915
0099,discard,"Random cutpoint tree ensemble+RSI: depth3,leaf120,4uniform cuts per chosen feature,bootstrap=True,trees=20,fixedseed711. Inspiration:Geurts/Ernst/Wehenkel,April2006,https://orbi.uliege.be/handle/2268/9357 . Local variant retaining return-shrunk leaves and5-day forecast,not exact library replication.",1805f2a622bf6965940bcc2c1d558cc33dfc74671d2eae19788084a29502971b,726,0.18614896429659433,0.061046163912501505,0.436606957838602,0.3079425556627011,0.29201101928374656
0100,discard,"Random cutpoint tree ensemble+RSI: depth3,leaf120,1uniform cuts per chosen feature,bootstrap=False,trees=60,fixedseed711. Inspiration:Geurts/Ernst/Wehenkel,April2006,https://orbi.uliege.be/handle/2268/9357 . Local variant retaining return-shrunk leaves and5-day forecast,not exact library replication.",ce5210a2a70aa6c4b04e169e9be4aafc5b984ee63b8a41777cd6d46bd9c03257,726,0.0552178988831844,0.01883119431362723,0.1943509816237941,0.326924656565834,0.1184573002754821
0101,discard,"Random cutpoint tree ensemble+RSI: depth3,leaf120,4uniform cuts per chosen feature,bootstrap=False,trees=60,fixedseed711. Inspiration:Geurts/Ernst/Wehenkel,April2006,https://orbi.uliege.be/handle/2268/9357 . Local variant retaining return-shrunk leaves and5-day forecast,not exact library replication.",01210c5d8670ecb650182efff516de9cf298dc07c31834ce7e3eac497e3d30c2,726,-0.007636112439313281,-0.0026571866078684003,0.07717542712060926,0.24596991820087744,0.18181818181818182
0102,discard,"Random cutpoint tree ensemble+RSI: depth5,leaf120,1uniform cuts per chosen feature,bootstrap=False,trees=60,fixedseed711. Inspiration:Geurts/Ernst/Wehenkel,April2006,https://orbi.uliege.be/handle/2268/9357 . Local variant retaining return-shrunk leaves and5-day forecast,not exact library replication.",fed565f59525c2babc329c32d1f07d1fcc01a888be7ba49ea35c34b06a817e0d,726,0.29170291182510577,0.09291246357236393,0.573717658536692,0.21976559592766953,0.22589531680440772
0103,discard,"Random cutpoint tree ensemble+RSI: depth5,leaf60,1uniform cuts per chosen feature,bootstrap=False,trees=60,fixedseed711. Inspiration:Geurts/Ernst/Wehenkel,April2006,https://orbi.uliege.be/handle/2268/9357 . Local variant retaining return-shrunk leaves and5-day forecast,not exact library replication.",844d806b8e264bc8895de42a0f73e3c9284f61c062ee6f9d793a42c1191cf978,726,0.21786949586277227,0.07081059100743481,0.4766154930349693,0.2713834987891076,0.3168044077134986
0104,discard,"Random cutpoint tree ensemble+RSI: depth3,leaf120,4uniform cuts per chosen feature,bootstrap=True,trees=60,fixedseed711. Inspiration:Geurts/Ernst/Wehenkel,April2006,https://orbi.uliege.be/handle/2268/9357 . Local variant retaining return-shrunk leaves and5-day forecast,not exact library replication.",f963d10e5d3cc2e0d524c0ae06123e9dec9987d4b890c899a9d3614446208488,726,0.12946178253582974,0.04316283248846586,0.3287219999437511,0.26254221577846326,0.2809917355371901
0105,discard,"Forest+RSI prediction smoothing: EMA2 of forest return estimates only,retain independent reversal state; reduce near-boundary trades.",650ca5b56ae923dbf9d6c08ae3b240c87819b1b20ff759140de51cc529862e4e,726,0.47458068409800025,0.1443163548480959,0.8727231646982113,0.1825790129503161,0.12396694214876033
0106,discard,"Forest+RSI prediction smoothing: EMA3 of forest return estimates only,retain independent reversal state; reduce near-boundary trades.",4bdf3ddd89c088ce7e06c157e7010799d9b1dabf1ee0dcdf26e0c11c56b39001,726,0.4915748362515724,0.14887687453337106,0.9091272696464943,0.20426461501336646,0.07988980716253444
0107,discard,"Forest+RSI exit hysteresis: forecast must fall below-10bp before forest sleeve exits,retain10bp entry; RSI sleeve unchanged.",b2662ddb4958caae8c2ecde6d03c964cf2835c844828f3c5e43caa49d3d938e5,726,0.28458773562287365,0.09081905048250616,0.5593084440931999,0.26138462362265014,0.12121212121212122
0108,discard,Forest+RSI minimum forest holding of2 sessions: damp single-day predictor flips without changing RSI sleeve.,0d2eec6c025369d5a0f45f1cde79c4acfeab5b25c5b9328cea2cf27086ddb886,726,0.4034261719080692,0.12483959400894862,0.7551392396945608,0.227056730636793,0.18732782369146006
0109,discard,"Train-only historical analogues+RSI union: inverse squared-distance weighted75nearest neighbors on standardized15causal features; predict5-day training returns,shrink by10 pseudo-weight,entry>2bp per forecast day,exit<0. Neighbor bank fixed before validation,not updated from validation labels.",60ed0ed645813ea96d39bbc6a5acdb0d214b8be75d96045aadc121e80bd2f9a3,726,0.23218321033030853,0.07516239613147824,0.5338217706737876,0.2752670713875177,0.2865013774104683
0110,discard,"Train-only historical analogues+RSI union: inverse squared-distance weighted150nearest neighbors on standardized15causal features; predict5-day training returns,shrink by10 pseudo-weight,entry>2bp per forecast day,exit<0. Neighbor bank fixed before validation,not updated from validation labels.",e72eacac0149a2c61a17f17f7e01cdcd33e75fd5410fad8f68da5313de697dc2,726,0.1788446490921234,0.05877361307082363,0.4359714890775322,0.2963244480567264,0.27548209366391185
0111,discard,"Train-only historical analogues+RSI union: inverse squared-distance weighted300nearest neighbors on standardized15causal features; predict5-day training returns,shrink by10 pseudo-weight,entry>2bp per forecast day,exit<0. Neighbor bank fixed before validation,not updated from validation labels.",90fc48cb42878eefbd0e6147ab3dc4416f72d7e9b211425d42f43852f835bd63,726,0.3417968256794186,0.10744208660931465,0.6969248456397219,0.2514346064475711,0.24793388429752067
0112,discard,"Train-only historical analogues+RSI union: inverse squared-distance weighted150nearest neighbors on standardized8causal features; predict5-day training returns,shrink by10 pseudo-weight,entry>2bp per forecast day,exit<0. Neighbor bank fixed before validation,not updated from validation labels.",be68afc1b5908be1efb11649e0225066236697e8c2301bcd967f4443dd7d2701,726,0.13496363800348576,0.04492385274497601,0.34839699119729156,0.23407758260959122,0.27548209366391185
0113,discard,"Train-only historical analogues+RSI union: inverse squared-distance weighted150nearest neighbors on standardized8causal features; predict1-day training returns,shrink by10 pseudo-weight,entry>2bp per forecast day,exit<0. Neighbor bank fixed before validation,not updated from validation labels.",6efe114e7317de5690feb2ccc54108eb76108512c6119fc820083d82af81561d,726,0.21490477480653825,0.06990505626693455,0.5037804197139345,0.19886393587704398,0.30578512396694213
0114,discard,"Train-only historical analogues+RSI union: inverse squared-distance weighted150nearest neighbors on standardized8causal features; predict10-day training returns,shrink by10 pseudo-weight,entry>2bp per forecast day,exit<0. Neighbor bank fixed before validation,not updated from validation labels.",309b779d62fc44e241534409f3d38150de1c4898f5f0bf46f2abfc39c69a39fd,726,-0.05942819002534483,-0.021041794777074907,-0.021632108820570917,0.3301001759503239,0.21487603305785125
0115,discard,Volatility-normalized forest+RSI: divide return and MA-deviation features by current trailing20-day return volatility; retain raw RSI/OHLC/volume terms. Tests risk-relative regimes rather than absolute moves.,54225d4034a1b9757f8dbbddafa163375cce7306f18af6c384820875854c0e45,726,0.21488654677670338,0.06989948429681236,0.48206682627523256,0.18867107539457106,0.24242424242424243
0116,discard,"Training recency restriction: fit forest on last1000supplied training records only,retaining5-day target/depth3/minleaf120 and RSI union. Uses no2020-or-later observations in fitting.",ae64708d727934f3b07ec51a8b35467ac0a6aca4cf5014f571a7a24894465601,726,-0.0029375798980130208,-0.0010206352292766452,0.0691772437624882,0.2645111300071602,0.15426997245179064
0117,discard,"Training recency restriction: fit forest on last1500supplied training records only,retaining5-day target/depth3/minleaf120 and RSI union. Uses no2020-or-later observations in fitting.",05515a49453523baabaa99447284ffd77a25584b328378c6056cdd5be96bb47a,726,0.27401839695246455,0.08769533907723615,0.52242459076733,0.29105696515659296,0.16804407713498623
