attempt,status,description,strategy_sha256,days,total_return,annual_return,sharpe,max_drawdown,mean_turnover
0118,discard,"Gradient boosting squared-error residual trees depth1, stages30, shrinkage0.1, train-only 5day labels; retain RSI union. Friedman October2001 https://doi.org/10.1214/aos/1013203451 inspires additive error correction versus bootstrap averaging; standard-library adaptation.",2fd11c658f4149c76e306fbe1c61a7477ca9525a541dbdbae3433826eba3dc90,726,0.32021426185330704,0.10122630168294267,0.6465938044911294,0.2515461283039946,0.17079889807162535
0119,discard,"Gradient boosting squared-error residual trees depth2, stages30, shrinkage0.1, train-only 5day labels; retain RSI union. Friedman October2001 https://doi.org/10.1214/aos/1013203451 inspires additive error correction versus bootstrap averaging; standard-library adaptation.",ec042775eb108382d293fdbec73caa9768fb69d9d08574f0cef8aaa664a8ead5,726,0.3504361910308842,0.10991193026378876,0.7062608027928539,0.2632314884640765,0.21487603305785125
0120,discard,"Gradient boosting squared-error residual trees depth3, stages30, shrinkage0.1, train-only 5day labels; retain RSI union. Friedman October2001 https://doi.org/10.1214/aos/1013203451 inspires additive error correction versus bootstrap averaging; standard-library adaptation.",f5d25e747bbb8f66bf3a395008fca7436bf97caf4e3f3953c63f0103bd58aaa4,726,0.33123119111585164,0.1044074020494572,0.6863506352521277,0.24291909645849585,0.21487603305785125
0121,discard,"Gradient boosting squared-error residual trees depth2, stages80, shrinkage0.05, train-only 5day labels; retain RSI union. Friedman October2001 https://doi.org/10.1214/aos/1013203451 inspires additive error correction versus bootstrap averaging; standard-library adaptation.",da35c0a5ac32ba2974faddb5bf8bdbfae2e1e0e8865678e50bd4e2ec6f904765,726,0.15564360570820224,0.051493639896398546,0.3712282485741369,0.2888683938029576,0.20385674931129477
0122,discard,"Gradient boosting squared-error residual trees depth3, stages80, shrinkage0.05, train-only 5day labels; retain RSI union. Friedman October2001 https://doi.org/10.1214/aos/1013203451 inspires additive error correction versus bootstrap averaging; standard-library adaptation.",454f630028862b0e4af2cf0625238e466975761ca5980a6b7fd95e1450bf6b36,726,0.3497662083854465,0.10972076354960514,0.7099346491122264,0.3382891539980424,0.24517906336088155
0123,discard,"Gradient boosting squared-error residual trees depth2, stages150, shrinkage0.05, train-only 5day labels; retain RSI union. Friedman October2001 https://doi.org/10.1214/aos/1013203451 inspires additive error correction versus bootstrap averaging; standard-library adaptation.",b46ac2f622bacbf36a6d9d0648c8f4eb2bbcf283902b4a189f041648c0065085,726,0.3190002344455436,0.10087469672991745,0.6742942148562245,0.26364498097314326,0.256198347107438
0124,discard,"Complementary forest and gradient-boosted model ensemble: prediction, boosted prediction weight0.25; original20tree forest depth3 plus30stage depth2 boosting; each independently train-only fit; RSI reversal retained. Friedman October2001 https://doi.org/10.1214/aos/1013203451 methodological source.",0e87e278048f194b1f6f9c9b6e751a1dbe6ba41e72c16ab1e78bdc67326d60ce,726,0.4725889398287486,0.14377961151634078,0.8703663331366279,0.21001668991695555,0.19559228650137742
0125,discard,"Complementary forest and gradient-boosted model ensemble: prediction, boosted prediction weight0.5; original20tree forest depth3 plus30stage depth2 boosting; each independently train-only fit; RSI reversal retained. Friedman October2001 https://doi.org/10.1214/aos/1013203451 methodological source.",38301aafd8534b9f3848841457c3b3de90d4c337d9f4f5f73dd2162def6b7967,726,0.3954694583637124,0.12262188671414265,0.7620942532276992,0.26868001204072844,0.21212121212121213
0126,discard,"Complementary forest and gradient-boosted model ensemble: prediction, boosted prediction weight0.75; original20tree forest depth3 plus30stage depth2 boosting; each independently train-only fit; RSI reversal retained. Friedman October2001 https://doi.org/10.1214/aos/1013203451 methodological source.",f47da4e6b0049de9dfd472cd76f64f97785bc72d7e7222aa571452f1aa4863e2,726,0.3946532280355648,0.12239391930622068,0.7703093365655056,0.2599164534738879,0.21212121212121213
0127,discard,"Complementary forest and gradient-boosted model ensemble: union, boosted prediction weight0; original20tree forest depth3 plus30stage depth2 boosting; each independently train-only fit; RSI reversal retained. Friedman October2001 https://doi.org/10.1214/aos/1013203451 methodological source.",da086214e4ebfee1c7e377cd525e06c7da551a2916ab37e45874dfeb76ef4af4,726,0.37432845751064603,0.11668903906027084,0.7120154079447001,0.2547795324124442,0.21487603305785125
0128,discard,"Complementary forest and gradient-boosted model ensemble: intersection, boosted prediction weight0; original20tree forest depth3 plus30stage depth2 boosting; each independently train-only fit; RSI reversal retained. Friedman October2001 https://doi.org/10.1214/aos/1013203451 methodological source.",a270d0b9042c66a9431eb399f7c4aa8ad3818d32dc995774a75c639597daf6a9,726,0.5663124704326463,0.1685404329274609,1.0405691432325204,0.17469624049222487,0.2066115702479339
0129,discard,"Complementary forest and gradient-boosted model ensemble: average, boosted prediction weight0; original20tree forest depth3 plus30stage depth2 boosting; each independently train-only fit; RSI reversal retained. Friedman October2001 https://doi.org/10.1214/aos/1013203451 methodological source.",132f2153ae9e5d9d053637cde14b8f1c879aaf5b351e12d40135f2b6875bc87a,726,0.4696512273766087,0.14298707903849084,0.887107871212111,0.21510763571719982,0.2110242042028254
0130,discard,"Continuous confidence sizing of forest: full exposure at predicted5day return0.0025, otherwise linear positive fraction; RSI reversal still100%. Hypothesis weak predictions merit less capital; fixed fit identical to0084.",e7227fbd9a157c50705e01668f30b11884f3e2cc21cff40711fb71fe965268da,726,0.37609259576293397,0.11718638245630064,0.8340826399115462,0.19268961042137644,0.23131495728287976
0131,discard,"Continuous confidence sizing of forest: full exposure at predicted5day return0.005, otherwise linear positive fraction; RSI reversal still100%. Hypothesis weak predictions merit less capital; fixed fit identical to0084.",2b9189bf6f121fc2305c0245356ea5a207c32854124dae9543ccf303118692b6,726,0.3643596572887884,0.11387078722367394,0.9148557427828428,0.13484939289342213,0.14521197661228707
0132,discard,"Forest signal persistence: enter after2consecutive forecasts above10bp, exit after1consecutive forecasts belowzero; RSI reversal unchanged. Hypothesis confirmed signals reduce transient model turnover; different from smoothing predictions or minimum holding time.",f572a2007d5788b9f8afa6b59e05dd72a49084daf8a6f55d37504874884f50eb,726,0.3777006942828163,0.11763937280178993,0.8145857625613732,0.1839949825866506,0.08264462809917356
0133,discard,"Forest signal persistence: enter after1consecutive forecasts above10bp, exit after2consecutive forecasts belowzero; RSI reversal unchanged. Hypothesis confirmed signals reduce transient model turnover; different from smoothing predictions or minimum holding time.",e02b865e9a2f36a1c5f8433f9ebbc6f11d1d1da51364165f94899ff4eaa20038,726,0.09915258328934962,0.0333597273084254,0.26545837034375586,0.2978537830572583,0.10743801652892562
0134,discard,"Forest signal persistence: enter after2consecutive forecasts above10bp, exit after2consecutive forecasts belowzero; RSI reversal unchanged. Hypothesis confirmed signals reduce transient model turnover; different from smoothing predictions or minimum holding time.",c870d9ba44841cedd0b75abd1e437ff03d45d7d24e28bbc46e5024ed69818ec6,726,-0.011276653838869,-0.003928709698956534,0.06953818999115713,0.27481870804261055,0.046831955922865015
0135,discard,"Forest signal persistence: enter after3consecutive forecasts above10bp, exit after1consecutive forecasts belowzero; RSI reversal unchanged. Hypothesis confirmed signals reduce transient model turnover; different from smoothing predictions or minimum holding time.",9edecf5912749780e6d65fb7938fed2e429681642a031a8f5ae302cefc9750b1,726,0.41857926280990343,0.12904048855474337,0.9339626583397442,0.14406584856313542,0.05785123966942149
0136,discard,"Two-sleeve staggered execution: half capital follows current combined forest/RSI signal and half previous signal; legal causal one-signal delay, total weight<=1. Hypothesis gradual transitions reduce unstable timing losses.",96328e93b4137c37d5070317d0513589d0c580543744df653592ea9dcd9fdc88,726,0.37395477623909246,0.11658363786917536,0.7412172951560559,0.18934269961220163,0.1311744050764147
0137,discard,"Conditional leaf-distribution forest: modequantile, quantile0.4, tail cutoff0; treewise normalized empirical bootstrap outcome weights, train-only5day labels. Quantile mode replaces mean signal and keeps RSI; tail mode gates combined exposure. Meinshausen June2006 https://www.jmlr.org/papers/v7/meinshausen06a.html inspires distributional risk rather than mean alone; adapted shallow forest.",a58aab75feecea2615f03d3d3aaeef89e7ac1d11a27ac4d28885155c98794568,726,0.2612046213784347,0.08388552201832011,0.8650410789434949,0.0986802709798611,0.01928374655647383
0138,discard,"Conditional leaf-distribution forest: modequantile, quantile0.5, tail cutoff0; treewise normalized empirical bootstrap outcome weights, train-only5day labels. Quantile mode replaces mean signal and keeps RSI; tail mode gates combined exposure. Meinshausen June2006 https://www.jmlr.org/papers/v7/meinshausen06a.html inspires distributional risk rather than mean alone; adapted shallow forest.",3eef5f0519fab6f51d08e284a0a99a268be8a6adbf4cb68a64b7416a364208f8,726,0.5514337835616296,0.16467546775224107,0.9579416920048013,0.19011773674435573,0.18732782369146006
0139,discard,"Conditional leaf-distribution forest: modetail, quantile0.1, tail cutoff-0.03; treewise normalized empirical bootstrap outcome weights, train-only5day labels. Quantile mode replaces mean signal and keeps RSI; tail mode gates combined exposure. Meinshausen June2006 https://www.jmlr.org/papers/v7/meinshausen06a.html inspires distributional risk rather than mean alone; adapted shallow forest.",78ae1ae36a076a92eff41e651c019ebfdf321c74f4ff5cf0ff67f1fe32cd227d,726,0.011455834929564812,0.00396162804307032,0.5640066297542686,0.0004999999999999449,0.0027548209366391185
0140,discard,"Conditional leaf-distribution forest: modetail, quantile0.1, tail cutoff-0.05; treewise normalized empirical bootstrap outcome weights, train-only5day labels. Quantile mode replaces mean signal and keeps RSI; tail mode gates combined exposure. Meinshausen June2006 https://www.jmlr.org/papers/v7/meinshausen06a.html inspires distributional risk rather than mean alone; adapted shallow forest.",aaefb9bc9c109e50f52b0856af000d815284db39c0a9eb681038de615e793cf3,726,0.5876591266133477,0.17404390878788423,1.0180235056443878,0.16772982417386717,0.21763085399449036
0141,discard,"Conditional leaf-distribution forest: modetail, quantile0.25, tail cutoff-0.01; treewise normalized empirical bootstrap outcome weights, train-only5day labels. Quantile mode replaces mean signal and keeps RSI; tail mode gates combined exposure. Meinshausen June2006 https://www.jmlr.org/papers/v7/meinshausen06a.html inspires distributional risk rather than mean alone; adapted shallow forest.",f5d012cb82b4d19fbeeee309e1e6fb2a172b28e7f8ab8260ff0e367761b4ec00,726,0.0,0.0,0.0,0.0,0
0142,discard,"Conditional leaf-distribution forest: modetail, quantile0.25, tail cutoff-0.02; treewise normalized empirical bootstrap outcome weights, train-only5day labels. Quantile mode replaces mean signal and keeps RSI; tail mode gates combined exposure. Meinshausen June2006 https://www.jmlr.org/papers/v7/meinshausen06a.html inspires distributional risk rather than mean alone; adapted shallow forest.",55783ebd073e5b2b81c798339073bbf885d5e5398e026f680d9441cd3d882dca,726,0.545497314907087,0.1631266258900852,0.9836519353258147,0.14924469400824458,0.26170798898071623
0143,discard,"Causal feature extension trend_persistence: distinguish persistence, volatility shape, candle pressure, signed volume or overnight versus intraday returns within120 supplied bars. Fixed forest5day horizon/depth3/minleaf120/20trees/seed711 and RSI union; no date features or validation fitting.",6473f0c0151475765da4fd36d041b0d450d97e28ad839c96225c44ff73df1802,726,0.16002852578403504,0.05287679594802075,0.37835573212892776,0.2276163841897526,0.10743801652892562
0144,discard,"Causal feature extension volatility_shape: distinguish persistence, volatility shape, candle pressure, signed volume or overnight versus intraday returns within120 supplied bars. Fixed forest5day horizon/depth3/minleaf120/20trees/seed711 and RSI union; no date features or validation fitting.",7ac8d34fe51a7da9226192a9801a64c6f953e5240ecad2a988df6cfca14d03c3,726,0.12976619608391582,0.043260414609729514,0.3230622112464423,0.25166627654097196,0.18732782369146006
0145,discard,"Causal feature extension candle_pressure: distinguish persistence, volatility shape, candle pressure, signed volume or overnight versus intraday returns within120 supplied bars. Fixed forest5day horizon/depth3/minleaf120/20trees/seed711 and RSI union; no date features or validation fitting.",b1d887af2243586d777ca67813c359bad1a76a3d0badc75568c05f30bd8a4e3d,726,0.2956529760977238,0.09407139512560514,0.6262531352122755,0.2023026966939201,0.162534435261708
0146,discard,"Causal feature extension volume_pressure: distinguish persistence, volatility shape, candle pressure, signed volume or overnight versus intraday returns within120 supplied bars. Fixed forest5day horizon/depth3/minleaf120/20trees/seed711 and RSI union; no date features or validation fitting.",e7963198ca0d748f60b9fd4ef731a702863baaec9d1908f52ec83f9177075bf2,726,0.16029887856018865,0.052961962801194584,0.3777470255250935,0.2212408147357282,0.15977961432506887
0147,discard,"Causal feature extension overnight_intraday: distinguish persistence, volatility shape, candle pressure, signed volume or overnight versus intraday returns within120 supplied bars. Fixed forest5day horizon/depth3/minleaf120/20trees/seed711 and RSI union; no date features or validation fitting.",fb069858623d99c9e0d3c5ad8375aae9f50d5e057202ab0af74bc2174b7a6172,726,0.22437770264190515,0.07279340102429721,0.4700812807159487,0.17556403226711415,0.09090909090909091
0148,keep,"Causal feature extension trend_and_volatility: distinguish persistence, volatility shape, candle pressure, signed volume or overnight versus intraday returns within120 supplied bars. Fixed forest5day horizon/depth3/minleaf120/20trees/seed711 and RSI union; no date features or validation fitting.",ba3bbd1ff33e763bd93c934a787b2a709489a2c1ce56bb9da93aed48179ab144,726,0.7823737667822332,0.22214727566656234,1.2958062507660895,0.14385805865041612,0.15151515151515152
0149,keep,"Causal feature extension all_five_groups: distinguish persistence, volatility shape, candle pressure, signed volume or overnight versus intraday returns within120 supplied bars. Fixed forest5day horizon/depth3/minleaf120/20trees/seed711 and RSI union; no date features or validation fitting.",31af21985583243e2ddc9223337688fffaa89637f5ad47f3d56d9a122b3d8829,726,0.8266178226190237,0.2325934615287173,1.2822191252928388,0.2122561904164223,0.14049586776859505
0150,discard,"Feature-group ablation of0149: removetrend_persistence indices15:21; retains remaining groups and original forest/RSI rules. Tests whether improvement needs this information; fixed seed711, no date features.",271d9cc0a4b2a6510cc7c2fd47b17283fa75ce8fbcb1d872a93787fe986cbea6,726,0.2464976402842478,0.07948153455542761,0.5008917511183634,0.22941752989961461,0.1487603305785124
0151,discard,"Feature-group ablation of0149: removevolatility_shape indices21:25; retains remaining groups and original forest/RSI rules. Tests whether improvement needs this information; fixed seed711, no date features.",21b0a82f1a381eacdc507a715895a21f609ff8a4262095afa1b55966656af07f,726,0.2830664878525402,0.0903704902301119,0.5844471218756867,0.2766378640971777,0.1349862258953168
0152,discard,"Feature-group ablation of0149: removecandle_pressure indices25:31; retains remaining groups and original forest/RSI rules. Tests whether improvement needs this information; fixed seed711, no date features.",383f6f1116c9fa3469ae4875b85422bb1e07fc88dc60b1a8ed2e501dd23d82ce,726,0.04742512064240545,0.016213214269596543,0.18036693358628442,0.30037891204586176,0.14600550964187328
0153,discard,"Feature-group ablation of0149: removevolume_pressure indices31:34; retains remaining groups and original forest/RSI rules. Tests whether improvement needs this information; fixed seed711, no date features.",23382665e0202e8fce2559d78a90239a88e9e79dcfd76332f8206308cfddc1e0,726,0.14514815367749456,0.04816903582410581,0.36359016599035254,0.24351714706048333,0.11019283746556474
0154,discard,"Feature-group ablation of0149: removeovernight_intraday indices34:40; retains remaining groups and original forest/RSI rules. Tests whether improvement needs this information; fixed seed711, no date features.",e783dc24287a8c95053cb2574780ce836eff73d4e2c4a2382fd5d5dd7c158653,726,0.27410054110086035,0.08771968145394426,0.5750899815345494,0.24259254244983053,0.18457300275482094
0155,discard,Forest ensemble stabilization: increase0148from20to60trees with unchanged seed711/depth3/leaf120/features and allocation. Tests whether feature-extension improvement persists with more bootstrap averaging.,16d14ce662ad28b9c4448d522b6f77ec6bfd4b02e86269a0e440085f6d8bc013,726,0.2721319536695812,0.08713603332449082,0.5425117492829947,0.21435307573905216,0.162534435261708
0156,discard,Forest ensemble stabilization: increase0149from20to60trees with unchanged seed711/depth3/leaf120/features and allocation. Tests whether feature-extension improvement persists with more bootstrap averaging.,6dd39b425c8e939ce5abca6b6f29fc4615259bf6ed54f85f824e714df45b1615,726,0.23779304347394037,0.07685895259546971,0.4862516441891597,0.19853480185354,0.08539944903581267
0157,discard,"Separate feature-view forests all_trend, aggregationprediction: each model20trees independently seeded711 and fit only2010-2019; combine predictions or persistent signals; common RSI reversal overlay. Hypothesis separate views complement each other without competing for individual tree split candidates.",a83fda39569ea31786fb7a1fb426d4f147d00eeae2ab37496760b37d50883592,726,0.7469382980350796,0.21365806218690953,1.2031599996350186,0.18284933989627572,0.12396694214876033
0158,discard,"Separate feature-view forests all_trend, aggregationunion: each model20trees independently seeded711 and fit only2010-2019; combine predictions or persistent signals; common RSI reversal overlay. Hypothesis separate views complement each other without competing for individual tree split candidates.",499365c4f1ef5a1dbcd8214cb52bed985d2d155ee235defcc7c9ae8cea991047,726,0.6778898128793989,0.19678754512769214,1.0622353736520165,0.18901447014401573,0.1487603305785124
0159,keep,"Separate feature-view forests all_trend, aggregationintersection: each model20trees independently seeded711 and fit only2010-2019; combine predictions or persistent signals; common RSI reversal overlay. Hypothesis separate views complement each other without competing for individual tree split candidates.",116a81a85ecd93ed9c28cec6cafd28d27566f85ab746bdfe69c3a2b4e4602d6a,726,0.9442488074877566,0.2595862521181662,1.5776268865428342,0.1438580586504158,0.13774104683195593
0160,discard,"Separate feature-view forests all_base, aggregationprediction: each model20trees independently seeded711 and fit only2010-2019; combine predictions or persistent signals; common RSI reversal overlay. Hypothesis separate views complement each other without competing for individual tree split candidates.",b6383cbf4b57ee37ea71c9879c0eff2c733af0b55c659fd3ce8c71a771adc90e,726,0.39352172634902005,0.12207775469738924,0.7483999703274176,0.25561201115436805,0.1487603305785124
0161,discard,"Separate feature-view forests three_models, aggregationprediction: each model20trees independently seeded711 and fit only2010-2019; combine predictions or persistent signals; common RSI reversal overlay. Hypothesis separate views complement each other without competing for individual tree split candidates.",9a6cccf5465819891dce38500d02cbe096e63aa821e623613a0c8d024c1f1e94,726,0.5745632532879126,0.17067337530151816,0.9733629253755719,0.18189253723113952,0.14600550964187328
0162,keep,"Separate feature-view forests three_models, aggregationmajority: each model20trees independently seeded711 and fit only2010-2019; combine predictions or persistent signals; common RSI reversal overlay. Hypothesis separate views complement each other without competing for individual tree split candidates.",69ea7213f0462f0ea5b9d9d5b4a53605455a5e37d7819b390641f05514016057,726,0.9469393408487881,0.26019101104081965,1.4450941878516175,0.1468632879161147,0.20110192837465565
0163,discard,"Separate feature-view forests five_specialists, aggregationprediction: each model20trees independently seeded711 and fit only2010-2019; combine predictions or persistent signals; common RSI reversal overlay. Hypothesis separate views complement each other without competing for individual tree split candidates.",a7df3de7759ca2abfa4438d6e6933d1c0588703679956aa06f896a438d39d925,726,0.22806714762359293,0.07391438376999271,0.4775752587850632,0.18303795621206997,0.1349862258953168
0164,discard,"Reversal overlay ablation on0162: remove_reversal. Forest fitting, feature views, entry10bp/exit0, and voting unchanged. Tests whether discretionary oversold override complements model consensus or adds unsupported exposure.",add1f49fc41c1e6e77d65eeb9a3d4ad9729b1edb56a09a6dcc1e012da942261f,726,0.8414138832853031,0.23604996803896627,1.3760604708170867,0.14380146694441676,0.2369146005509642
