attempt,status,description,strategy_sha256,days,total_return,annual_return,sharpe,max_drawdown,mean_turnover
0170,discard,"Adaptive-moving-average trend baseline: Kaufman efficiency length10, fast2/slow30, close-vs-KAMA hysteresis band half trailing daily volatility in price units. Hypothesis adapt smoothing to path efficiency to reduce fixed-SMA lag/whipsaw; no fitting, no date rules. TradingView KAMA method docs, undated accessed2026-09-15 https://www.tradingview.com/support/solutions/43000773012-kaufman-s-adaptive-moving-average-kama/ .",ffd6bd7087e90399c4c2aa0e56068cd71ff4775248697dabe98a87e17e2cf1c9,754,0.07633273652804484,0.024889623450129905,0.2665029521670121,0.1612883302830601,0.08222811671087533
0171,discard,"KAMA state features for monthly ridge: append volatility-normalized price deviation, five-session adaptive-average slope and current adaptive smoothing coefficient. Same training-only purged ridge CV and shock gate. Hypothesis learned forecast can use adaptive trend information without rigid crossing rules. TradingView KAMA method docs, undated accessed2026-09-15 https://www.tradingview.com/support/solutions/43000773012-kaufman-s-adaptive-moving-average-kama/ .",6d195c2f24e00e18f121a787aa5ed7f19befe5aa536b1dccc49dd334792db8e5,754,0.7303326289677323,0.20112188554932597,1.1250754667713325,0.21289549940371566,0.05570291777188329
0172,discard,"Hull moving-average monthly features: append normalized close deviation and five-session slope of HMA20 and HMA60, using weighted-average lag compensation and rounded square-root smoothing. Hypothesis low-lag trend features add information beyond SMA200 and normalized raw momentum. Same purged training CV/gate. Fidelity HMA docs, undated accessed2026-09-15 https://www.fidelity.com/learning-center/trading-investing/technical-analysis/technical-indicator-guide/hull-moving-average .",9bf6bb89d600597875c1cba13bf475e63550f4b7fb4034f3934bdac2bd5350cf,754,0.6460318742487985,0.18123810758181258,1.0314260471480639,0.21289549940371655,0.0610079575596817
0173,discard,"Training empirical-rank Gaussianization: replace all nine close-only predictor values with normal quantiles of their training empirical marginal CDF, midrank ties and tail probability clamp 0.001/0.999. Fold-specific transforms, purged training ridge CV, unchanged monthly labels and shock gate. Hypothesis rank-based features reduce sensitivity to heavy-tailed magnitude changes while preserving ordering.",7362b9c3ee446f9677be7447fb7371a7295e3e1b487cf2dcb406ea64edb29962,754,0.6654083869153173,0.18586734970649887,1.0550836083067572,0.2128954994037161,0.06631299734748011
0174,discard,"Mixed magnitude/rank monthly model: concatenate original nine close-only features with their train-empirical Gaussian rank transforms. Hypothesis keep informative magnitude variation while allowing different nonlinear responses across common and extreme states. Entire transform fitted within each purged training fold, then full refit; unchanged original shock gate.",f37ab9a011fc28159b50f2a5b26b1ca96cedd25f667a640aa815721ae424228e,754,0.5485139596063673,0.15737196829544708,0.922073962660528,0.21289549940371622,0.05570291777188329
0175,discard,"GARCH-normalized innovation shock gate: fit stationary GARCH(1,1) to training close log returns by Gaussian likelihood over fixed alpha/beta candidates, variance-target intercept. Gate score is RMS of last five standardized innovations, each normalized by variance forecast before that return; train95/70 quantiles and original price/recovery rules. Hypothesis surprise relative to conditional volatility is more useful than raw fast/slow volatility; monthly return model unchanged. Method inspiration: Bollerslev, Journal of Econometrics April1986, https://doi.org/10.1016/0304-4076(86)90063-1 ; variance targeting plus finite training likelihood search is an adapted implementation.",006248bab9df28dc30069fbf5231bf1547d5f85ce977159fb1d4257fe18b85dc,754,0.7019545940515468,0.19450192651239373,1.11613757029876,0.2388680133888249,0.07692307692307693
0176,discard,"GARCH forecast-volatility shock gate: same train-fitted variance model, risk score is sqrt(next conditional variance / mean previous60 conditional variances). Same train95/70 quantiles, monthly forecast and gate transitions. Hypothesis modeled volatility persistence identifies risky regimes after transient innovations fade; recursion uses only trailing252 closes. Method inspiration: Bollerslev, Journal of Econometrics April1986, https://doi.org/10.1016/0304-4076(86)90063-1 ; variance targeting plus finite training likelihood search is an adapted implementation.",1f6af9c3d9523efb8ebabea85c9814a965b97ad98a94b6d98d78260f12166334,754,0.4118014590452028,0.12216564315444467,0.7584775987387276,0.316076398915938,0.08488063660477453
0177,discard,"Learned nonlinear monthly predictor: one tanh hidden layer with eight units, deterministic seed, train-standardized inputs/targets, minibatch32 SGD and mild weight decay. Purged late-training monthly MSE selects 200/600/1200 updates, then full-training refit; original shock gate. Hypothesis learned nonlinear projections improve beyond fixed random features; no validation gradient or fitting.",06ca03b1e827834fa4ca1af5c3209c48f7917932873beff8f89c65598227baf2,754,0.695384081529878,0.19295871199485903,1.0986280279263425,0.20109786147239284,0.05570291777188329
0178,discard,"Learned nonlinear residual monthly predictor: same eight-unit tanh network models residual around fixed ridge0.1 linear skip forecast, preserving linear structure while learning smooth interactions. Purged training early stopping selects update count, all full-training refits deterministic; original shock gate. Hypothesis residual initialization is more stable than an entirely nonlinear signal.",ebbac9dee9c3ef9bb328d06b8be37d02390655786f47059b8511d11ce4f8bf4a,754,0.5302460489088705,0.15279066209192793,0.9088797043362442,0.20109786147239261,0.0636604774535809
0179,keep,"Linear/nonlinear forecast diversification: equal-average original purged-CV monthly ridge forecast and independently trained eight-unit tanh monthly forecast, then apply common signal hysteresis and shock gate. Both base model selection procedures use training only; fixed 50/50 weight. Hypothesis different inductive biases reduce forecast sign errors despite neither nonlinear model individually exceeding current champion.",777081eb2029cd49f64d686250bec7c4ffc875b5d0fe60853ede4653fa970283,754,0.7536528513985159,0.20650806782346454,1.1517535206395897,0.212895499403716,0.05570291777188329
0180,discard,"Linear/nonlinear allocation diversification: same independently fitted monthly ridge and tanh models, keep separate binary signal hysteresis states and average their allocations before the shared shock gate. Hypothesis partial exposure on model disagreement can retain profitable periods lost by averaging noisy forecast magnitudes. Fixed equal weights, no validation-fit stacking.",2ff7ae731662f59ba6873a2de649e31674f47e4a16bf0e4e6ba1de8a938c1165,754,0.7161444563080337,0.1978212133840176,1.1221245360276713,0.20399200805461615,0.05982211901663521
0181,keep,"Noise-regularized linear/nonlinear ensemble: add independent Gaussian noise sd0.1 to standardized neural training inputs only, preserving minibatch RNG sequence and clean inference. Original ridge, fixed 50/50 forecast blend, purged training early stopping and shock gate unchanged. Hypothesis local input smoothing stabilizes neural decisions without adding features or tuning validation weights.",fee090a2d7265cbc0d417810fa15d29dca137e95533c3fe9ad878b5700c98dfc,754,0.7732181419383557,0.2109903177870318,1.1721858498280717,0.21289549940371555,0.05570291777188329
0182,discard,"Robust-loss linear/nonlinear ensemble: neural minibatch gradients use Huber derivative cutoff1.345 in standardized target units; keep original clean inputs, ridge forecast, equal blend, purged training MSE early stopping and risk gate. Hypothesis downweighting rare extreme residuals yields a more useful nonlinear complement to ridge.",87ae6aac301b05b15e43feba7626a911c1b73033346c06a2d652adb7b79c29c9,754,0.7284561227334618,0.20068638015218299,1.1227989301086718,0.21329247416664232,0.05305039787798409
0183,discard,"Ensemble-aware neural early stopping: select neural 200/600/1200-step checkpoint by MSE of its equal forecast blend with a ridge model fitted to exactly the corresponding purged training prefix. Then refit both full-training models. Hypothesis the most useful ensemble member need not minimize its own standalone error; fixed equal blend, unchanged architecture/gate, no validation fitting.",b49fe71456fae55a6bff6c68fb0e33a9d0799b0c5bf452b27b1e7d592413e340,754,0.7536528513985159,0.20650806782346454,1.1517535206395897,0.212895499403716,0.05570291777188329
0184,discard,Fixed three-seed neural averaging with noisy inputs: average all networks seeded 6047/6048/6049 without seed selection; choose their shared 200/600/1200 checkpoint using purged training mean-forecast MSE. Equal blend with unchanged ridge and shock gate. Hypothesis averaging initialization and minibatch variation stabilizes the nonlinear complement; no validation-fitted seeds or weights.,6c458bda66909a742d22615c3a13e5393f27c0ebafb7621450e718aa5de23862,754,0.6872209204320539,0.1910358757958599,1.0702080527745301,0.21289549940371522,0.04509283819628647
0185,discard,"Training checkpoint prediction averaging: average all noisy-neural checkpoints up to 200,600,1200, selecting cumulative endpoint solely by purged training MSE then refitting all retained checkpoints. Fixed equal ridge blend and shock gate. Hypothesis temporal averaging along one training trajectory reduces forecast variance without selecting lucky seeds.",fcf000928adfaad12b3b1a042b8b4f9a70cf98af76ebd8612898b6f8ecc424d0,754,0.7732181419383557,0.2109903177870318,1.1721858498280717,0.21289549940371555,0.05570291777188329
0186,discard,"Nonoverlapping-target neural minibatches: each step sample 32 distinct training starts from one randomly chosen 20-session phase, so no monthly forward-label windows overlap within the batch. Preserve noisy-input architecture, train-only checkpoint selection, equal ridge blend and gate. Hypothesis reducing duplicated target information per gradient gives a more useful nonlinear estimate.",3a24229d1c24d5ce86dae31e8d8c3100caf9f99ea4463936f0b821e6cc49a790,754,0.6929434415031599,0.1923844653359923,1.0771140859309976,0.213292474166643,0.04509283819628647
0187,discard,"OHLC variance shock gate: replace close-return standard-deviation ratio with sqrt(mean5/mean60) of Rogers-Satchell intraday variance plus squared overnight gaps; training 95/70 quantiles and all forecast components unchanged. Hypothesis within-session path variation detects risk shifts hidden in closes. Method inspiration Rogers and Satchell, November 1991, https://www.skokholm.co.uk/wp-content/uploads/2016/01/R_Satchell_HLOC.pdf ; overnight squared gaps are our additional risk proxy, not an assertion of the paper's estimator.",3198c1ef250585d5b8aee4c9912e3768b7c9679b9b2c5e2b451724d0f0fbd394,754,0.5149988160551826,0.1489389347709218,0.8819423086573798,0.3173723694680659,0.05570291777188329
0188,discard,"Variance decomposition forecast features: append RS intraday volatility relative to close volatility, log intraday variance5/60 and overnight energy share20 to both ridge and noisy neural predictors; preserve original close-volatility shock gate. Hypothesis separating intraday oscillation from overnight moves helps distinguish drift from noisy risk. Method inspiration Rogers and Satchell, November 1991, https://www.skokholm.co.uk/wp-content/uploads/2016/01/R_Satchell_HLOC.pdf ; overnight squared gaps are our additional risk proxy, not an assertion of the paper's estimator.",ef18c63e723b58ad89a0b61421666c3c6abb858b16df8424e18d2a77a63a23f1,754,0.6597984057859367,0.18453077389579509,1.038051874775648,0.21329247416664188,0.04509283819628647
0189,discard,"OHLC-normalized forecast features: replace close-based 20/5-day volatility normalization in the existing nine features with square-root average RS-plus-overnight energy at identical horizons. Preserve original independent close-return shock gate and training-only model fitting. Hypothesis path-based scale estimates stabilize momentum and distance predictors. Method inspiration Rogers and Satchell, November 1991, https://www.skokholm.co.uk/wp-content/uploads/2016/01/R_Satchell_HLOC.pdf ; overnight squared gaps are our additional risk proxy, not an assertion of the paper's estimator.",c5b7b244884914ebccb28fd3e6ab92e408dab0ad3903854b55cc5bc921d4e743,754,0.6222697589140287,0.17551130294132244,0.9981027147877355,0.21289549940371566,0.04509283819628647
0190,discard,"Specialist nonlinear reversal expert: retain monthly ridge on nine close features; train the noisy neural member only on one/five-day returns, short-to-medium volatility ratio, volatility level and normalized drawdown. Fixed equal monthly forecast blend and shock gate, purged train-only early stopping. Hypothesis feature specialization reduces redundant long-trend learning and exposes nonlinear short-run effects.",9ecba260b23b8401e83f7d83fa0dddeb4bbb8def0617747512a77021d69c6a3d,754,0.6353214261807405,0.17866368911148478,1.0081359438384014,0.21329247416664276,0.03183023872679045
0191,discard,"Specialist nonlinear intraday expert: retain existing monthly close-feature ridge; train neural member only on short/medium volatility ratio, volatility level, latest candle close location, body, overnight gap and range. Fixed equal forecast blend and original gate, no additional data. Hypothesis a distinct OHLC information set provides more complementary nonlinear forecasts than sharing all close features.",390805ee7f031d0c26a422ea08d143d1071138c14124c768dd4d8b3bd05887d1,754,0.562337242414729,0.16081477076676776,0.9140136722272565,0.2132924741666422,0.023872679045092837
0192,discard,"Mixed-horizon linear/neural forecasts: original monthly ridge plus noisy neural five-session mean-log target, equal daily-unit forecast blend. Neural checkpoint selection uses purged training split with six-row gap; original features, architecture and shock gate. Hypothesis nonlinear short-horizon response complements slower linear expected returns; horizons and blend predetermined without validation fitting.",bc5baf0dd95e12421ca17ecf7759b19cf2fbf32ee1114b81b30893d9d06a3a86,754,0.5151789222104961,0.1489845831349399,0.894759745151818,0.20109786147239295,0.06896551724137931
0193,discard,"Purged three-fold training stack, convex forecast blend: fit base ridge/noisy-neural ensemble on expanding training prefixes ending21 rows before 50/65/80 percent boundaries; collect monthly-target OOF forecasts in later training blocks. Analytically fit clipped ridge weight0..1 by MSE with 10-percent quadratic shrink toward equal weights. Refit base full train, freeze blend and gate. Hypothesis complementary models merit a training-estimated blend.",f7266d3f56bbcf79bf86fa32f343a606b0e79e7e696254974ee01c2219b2707a,754,0.7353732484758473,0.20229017354930723,1.1319600614103944,0.21289549940371577,0.0636604774535809
0194,discard,Purged three-fold residual calibration: same expanding 50/65/80-percent training-prefix OOF predictions with21-row purge; fit ridge penalty1 on the two forecasts to predict residual of their equal blend against monthly log labels. Full-training base refit; freeze affine correction. Hypothesis conservative bias/scale calibration corrects mismatch between raw models and executable expected returns without fitting validation data.,d49b8c9a53c3dc19e87e34931c987b1c52b7c6db63cfbb5520695dc6ff6b4378,754,0.5628803064273582,0.1609496105709105,0.9146181756139186,0.21329247416664254,0.021220159151193633
0195,discard,"Purged three-fold economic hysteresis selection: base ensemble fit only on expanding prefixes with21-row purge, then select threshold among0,round-trip-cost/20,2.5bp,5bp using aggregate net log growth on three later training blocks with the prefix-trained shock gate, next-open labels, 0.05-percent switching and terminal costs. Full-training base refit; frozen threshold. Hypothesis decision threshold should reflect realized training utility rather than forecast MSE alone.",c00e9aee2aa777b7de1cfc8a5a035d987551fbe51001a301c644102db50d6ef7,754,0.5628803064273582,0.1609496105709105,0.9146181756139186,0.21329247416664254,0.021220159151193633
0196,discard,"Shared-trunk multi-horizon neural learning: eight tanh hidden units jointly predict standardized 20/5/1-session mean-log training targets with equally weighted squared losses; use only monthly output in fixed equal blend with original ridge. Noisy inputs, 200/600/1200 early stopping on purged monthly training MSE, unchanged shock gate. Hypothesis auxiliary shorter horizons regularize return representation without replacing the monthly decision target.",4b55a59058428c5b4dd1e58f01f285ee6a76111d0c82927e5a3adef804a594c5,754,0.6867861323584252,0.19093328770007756,1.0702371437530094,0.2132924741666432,0.04774535809018567
0197,discard,"Shared-trunk return/risk auxiliary learning: same eight-unit noisy neural trunk jointly predicts monthly mean log return, future20-session log-return volatility and downside RMS, each standardized from fitting rows. Use only return output with unchanged ridge/gate; purge21 and early stop by monthly training MSE. Hypothesis learning future dispersion jointly improves useful state representation; auxiliary labels exist only inside training data.",32d4758a7639f1ff3ba7457545c6d3ab76987dba0de2f23547be6ad8d55ef319,754,0.7095634359956553,0.1962840649156845,1.0940691876844755,0.21329247416664243,0.04509283819628647
0198,discard,"Shared multi-horizon forecast averaging: jointly train 20/5/1-session daily-unit log-return heads sharing an eight-tanh-unit noisy trunk; average all three daily-return predictions for the neural forecast, then equal blend with monthly ridge. Select checkpoint by purged training monthly MSE of this mean forecast. Hypothesis shared representation plus horizon diversification improves response while preserving fixed ex-ante combination weights.",b45a8cb46140f4bf0aaa07a3beac384b85105c62a3fb17f941c2ed52c2b452ef,754,0.5295945015848655,0.15262659332665218,0.9007903910449147,0.212895499403716,0.06896551724137931
0199,discard,"Payoff-weighted neural sign classification: replace neural squared-error target with monthly-return sign and logistic loss weighted by absolute monthly mean log return. Convert probability to signed forecast using fitting-sample average absolute return, blend equally with original ridge. Noisy inputs and purged train MSE checkpoint selection unchanged. Hypothesis economically weighted directional learning better prioritizes decisions than fitting return magnitude; global magnitude conversion is an explicit approximation.",d6fb59d927169726c0b7baeacb688e521370682367cb39bad10137ea95420d2c,754,0.6765267107431809,0.1885074547147516,1.0555654276830202,0.21329247416664232,0.034482758620689655
0200,discard,"Conditional-magnitude payoff-weighted neural classifier: use absolute-return-weighted logistic sign loss, then scale signed probability by a ridge penalty1 prediction of conditional absolute monthly return fitted on the same training rows. Equal original ridge blend and unchanged gate. Hypothesis estimating state-dependent magnitude corrects the constant-magnitude approximation of weighted directional forecasts; all fitting and early stopping remain training-only.",2cd3d03771be3752a94f577f488834fc635b9d3cebb2dc1da959c6fcefa8ac80,754,0.6153706761953446,0.17383813269544257,0.9823969013911906,0.2132924741666432,0.03183023872679045
0201,discard,"Standalone payoff-weighted neural timing: use monthly sign logistic loss weighted by absolute monthly mean log return, global-magnitude signed-probability forecast and original shock gate, without ridge forecast blending. Training-only purged checkpoint selection. Hypothesis an economically weighted directional classifier can serve as an independent timing family rather than only an ensemble component.",c36c235e63e7910aefe2fe7903ad0796a3306553c8570b3300a9862fb1bac648,754,0.5628803064273582,0.1609496105709105,0.9146181756139186,0.21329247416664254,0.021220159151193633
0202,discard,"Nonlinear direct-utility policy: replace earlier linear sigmoid policy with eight tanh hidden units and sigmoid weight0..1. Full chronological gradient ascent on exact daily net-log wealth including drifted prior weights, switching costs and final liquidation; fixed weight decay.01, select50/150 iterations on purged later training net growth. No external shock gate. Hypothesis optimizing executable economic utility directly learns nonlinear allocations missed by return forecasting. Inspired by direct utility optimization in Moody and Saffell, July2001, https://people.idsia.ch/~juergen/rnnaissance2003talks/MoodySaffellTNN01.pdf ; this candidate is a feedforward adaptation, not a paper reproduction.",56b4e2b2c0264cead4e75d4aecbeba5e6c05e8dd96c96edc50811a850e2e1bcf,754,0.16376723588922437,0.05199484683491051,0.3656776441357357,0.2992564079511615,0.009071213289218158
0203,discard,"Shock-aware nonlinear direct-utility policy: eight-tanh sigmoid allocation trained by exact chronological net-log-wealth gradient with training-calibrated shock gate inside objective. Include drift, switching and liquidation derivatives, fixed penalty.01, training-only50/150 checkpoint selection with two-row purge. Hypothesis nonlinear risk-conditioned utility training yields useful state-dependent exposure. Inspired by direct utility optimization in Moody and Saffell, July2001, https://people.idsia.ch/~juergen/rnnaissance2003talks/MoodySaffellTNN01.pdf ; this candidate is a feedforward adaptation, not a paper reproduction.",f9d07d6ecd679beaee3bfa594a73743aa04d5fdd82020d36f1206db9d061b1c0,754,0.49928434728356774,0.14494207204942922,0.915495607761641,0.19176556268658085,0.024289940381389652
