attempt,status,description,strategy_sha256,days,total_return,annual_return,sharpe,max_drawdown,mean_turnover
0204,discard,"Discrete execution of nonlinear utility policy: same shock-aware eight-tanh direct-net-growth training, but select checkpoint and execute through fixed0.6/0.4 probability hysteresis to index/cash. Fixed penalty.01 and purged training-only checkpoint choice. Hypothesis converting smooth allocation preferences into persistent binary exposure preserves growth while reducing small trades; optimize smooth surrogate but select using actual discrete training execution. Inspired by direct utility optimization in Moody and Saffell, July2001, https://people.idsia.ch/~juergen/rnnaissance2003talks/MoodySaffellTNN01.pdf ; this candidate is a feedforward adaptation, not a paper reproduction.",9b4660e8e4c3a7899d4b4852aa020c59a9cbe2c6f79692c0768cda3469d972b3,754,0.5628803064273582,0.1609496105709105,0.9146181756139186,0.21329247416664254,0.021220159151193633
0205,discard,"Causal L1 trend timing: fit piecewise-linear trend to latest64 log closes normalized by trailing20 volatility, fixed L1 curvature penalty10 and ADMM rho10; buy/cash according to latest three-session endpoint slope with ±0.005 normalized hysteresis. No fitting or dates, no shock gate. Hypothesis sparse slope changes identify persistent direction with fewer false reversals. Source Kim, Koh, Boyd and Gorinevsky, SIAM Review May2009, https://stanford.edu/~boyd/papers/l1_trend_filter.html ; causal rolling-endpoint adaptation with a fixed120-step ADMM approximation, not a full-sample retrospective smoother.",629eae3dc07b7a4427c3d5ed0585039bb16a47f104d0bcf788c8a0bb418823de,754,0.34056510348211244,0.10291450376218747,0.80600487912964,0.16324250421293107,0.058355437665782495
0206,discard,"Causal L1 trend plus volatility-break gate: same fixed64-session piecewise-linear endpoint-slope timing, combined with original training95/70 close-volatility shock gate. Hypothesis trend segmentation and abrupt-risk detection provide complementary exits. Source Kim, Koh, Boyd and Gorinevsky, SIAM Review May2009, https://stanford.edu/~boyd/papers/l1_trend_filter.html ; causal rolling-endpoint adaptation with a fixed120-step ADMM approximation, not a full-sample retrospective smoother.",893394949c95fbfb7aaf342a892564c5d08e9a1eec44328c8e2fa697567c8931,754,0.3413845228927055,0.10313977255471962,0.8075536225905042,0.16324250421293085,0.058355437665782495
0207,discard,"L1 trend representation in learned ensemble: append normalized recent endpoint slope, close-minus-filtered endpoint and slope change to the existing ridge/noisy-neural monthly forecasters. Preserve equal blend, purged training checkpoint choice and original gate. Hypothesis piecewise-linear trend geometry adds regime information beyond moving averages. Source Kim, Koh, Boyd and Gorinevsky, SIAM Review May2009, https://stanford.edu/~boyd/papers/l1_trend_filter.html ; causal rolling-endpoint adaptation with a fixed120-step ADMM approximation, not a full-sample retrospective smoother.",f16d860f1d138db943d8ff0fd6e4c54d81e56b5b73a231a4e91a4c171b32fd3e,754,0.640047853833086,0.17980113726345048,1.0184751394333658,0.21289549940371555,0.06896551724137931
0208,discard,"Ordered daily-path neural representation: preserve original nine-feature monthly ridge, but feed neural member the latest20 ordered one-session log returns normalized by current20 volatility, plus63 momentum, price/SMA200, SMA50/SMA200 and volatility. Noisy-input eight-unit model, train-only early stopping, equal blend and gate unchanged. Hypothesis learned short path motifs contain information lost by aggregate indicators.",36209048a604cfb76ecaa6dfb1a3385e32654ff45e3591a79931fd5050b99e54,754,0.5900663800903849,0.1676602724027123,0.9686537408274575,0.21289549940371522,0.0610079575596817
0209,discard,"Ordered weekly-block neural representation: neural member receives12 disjoint five-session normalized log-return blocks covering latest60 sessions, ordered oldest to newest, plus four slow trend/volatility features; original ridge and gate unchanged. Fixed monthly target and equal blend. Hypothesis aggregating within weeks suppresses daily noise while retaining the order of medium-term gains and losses.",728e8ad022a531d100e897137ccc3d54b80b8f98db5d4e3484ab80179bcb31ea,754,0.5053594483618553,0.14649052253295491,0.8624066820989729,0.21289549940371588,0.058355437665782495
0210,discard,Multiscale return-acceleration neural representation: append Haar-style differences between recent and preceding half-window log returns at2/4/8/16/32/64/128 sessions to the original nine neural inputs; scale by current volatility times square-root horizon. Keep ridge inputs unchanged. Hypothesis nonlinear combinations of accelerating and decelerating trends at distinct scales complement simple cumulative momentum.,bd497bf14b895e1a883ec5e9f7b5545300c77db46667186f76a5d13636730ceb,754,0.7155538736456453,0.19768342969586183,1.107581596702398,0.21329247416664232,0.05305039787798409
0211,discard,"Residual linear model tree: fit monthly global ridge then split its training residuals using largest squared-error mean reduction over feature terciles, depth2/minleaf200. Each leaf fits a ridge residual model, prediction shrunk by n/(n+500) toward global ridge. Preserve purged training ridge selection and original shock gate. Hypothesis local slopes capture regime-specific responses that constant regression trees miss.",65381f18c6a03ccedb0c4a0c42f56511698b955696e769b4dca3f0984c4653e2,754,0.47951993995781517,0.13987533716104572,0.85722730241188,0.20109786147239295,0.06896551724137931
0212,discard,"Residual linear model forest: average eight depth2/minleaf200 model trees, each considering four randomly sampled features per split with a fixed seed; leaf ridge residual correction shrunk by n/(n+500). Global monthly ridge and shock gate unchanged, ridge selected only on purged later training data. Hypothesis averaging alternative regime partitions reduces instability of local linear forecasts.",e5f53d4b575710076726f5aa0046d71f6d5c8c4e571ccea3e60fce008fa8fc54,754,0.471945982402703,0.1379217617920121,0.8358448521645401,0.21289549940371655,0.05305039787798409
0213,discard,"Full-target local linear tree with pooling: partition by global-ridge residual mean separation, but fit full monthly return models inside depth2/minleaf200 leaves and interpolate local/global predictions using n/(n+500). Original train-only ridge choice and risk gate. Hypothesis jointly changing local intercept and slopes handles regime variation better than an additive residual model.",e68a7ceb812f21bf707e7eb002485ed6a3bbe5fd47fe74c5327059788fa7aa3a,754,0.44487398717807225,0.1308837792194455,0.8086021637303017,0.21289549940371533,0.06631299734748011
0214,discard,"Training-covariance whitening for neural inputs: whiten the nine standardized/clipped neural features using fitting-only covariance shrunk10 percent toward identity and its Cholesky factor, then clip whitened coordinates. Preserve noisy training, ridge inputs, equal blend, gate and purged checkpoint selection. Hypothesis decorrelating redundant trend features improves nonlinear optimization and makes isotropic input noise more meaningful.",b6c8aef7c3d22eabf9ee0af9ed784b7ce6af031c8c8ac6884a99a14f4dbaa594,754,0.5358139728452989,0.1541908501666085,0.9016142101332605,0.21289549940371555,0.04509283819628647
0215,keep,"Feature dropout neural regularization: replace additive Gaussian input noise with independent10-percent inverted feature masking during neural training, clean inference and unchanged minibatch RNG; original ridge, equal blend and gate retained. Hypothesis preventing dependence on any one indicator produces a more stable nonlinear complement under changing market states.",6ae7aa180ed707e3a20be8862529c42895bcf62cb63cda85b349f098524e73f4,754,0.8097729659045891,0.2192772854581111,1.2102117319231382,0.21289549940371577,0.058355437665782495
0216,discard,"Hidden-unit dropout neural regularization: retain original Gaussian input perturbation and independently mask10 percent of hidden activations using inverted scaling with matching backprop derivatives; clean inference, original ridge and gate. Hypothesis discouraging hidden-unit coadaptation regularizes nonlinear interactions without changing available indicators or searching validation-tuned penalties.",bb34d5e96d665e72885c262e3b439b79d9d934c761e3c4ad11ce4a3e8d953712,754,0.7271941891842522,0.20039332963788592,1.1174877533693077,0.21289549940371555,0.05305039787798409
0217,discard,"Group-wise feature dropout: jointly mask four predeclared neural feature groups (short reversal, slow trend, volatility, drawdown) with10-percent probability and inverted scaling instead of independently masking individual coordinates. Keep original ridge, equal blend, gate and purged checkpoint selection. Hypothesis preserving relationships within correlated indicators while withholding entire information groups improves robustness.",77548d5d7d0ed1b73640c7f839b8f6bd555f67cb279fa8c1bd0b5f714905102c,754,0.7075078320259498,0.19580312407567546,1.0935823685830937,0.21329247416664332,0.04774535809018567
0218,discard,"Analytical dropout regularization for ridge member: add diagonal covariance penalty p/(1-p) times standardized feature second moment, p=.1, to the ridge normal equations. Keep neural feature dropout, equal forecast blend and gate; base ridge penalty still selected only on purged training data. Hypothesis extending missing-feature robustness to the linear member improves the combined forecast.",011dbfd490ee30f678150da0c59f73cc55dbed274ee5da9e20c056190548eae2,754,0.7225688098020862,0.19931798784170973,1.1121475374262473,0.21329247416664288,0.050397877984084884
0219,discard,"Exhaustive leave-one-feature-out neural ensemble: train nine fixed eight-hidden-unit networks, each with one of the nine indicators permanently masked during fitting and inference; equal-average every member, no random subset or seed selection. Select shared checkpoint by purged training ensemble MSE, full refit, equal blend with unchanged ridge/gate. Hypothesis explicit feature-subset averaging tests whether stochastic input dropout gains survive deterministic model averaging.",43b028fdae943d39118386ce065b0243bc8f4dc02ddc744a234c893ef1758070,754,0.8054314316277886,0.21829892709660137,1.2059485591800507,0.21289549940371588,0.0610079575596817
0220,discard,"Softsign neural interactions: replace tanh hidden activation and derivative with softsign x/(1+abs(x)), keeping input dropout, initialization, training schedule, purged checkpoint choice, equal ridge blend and shock gate. Hypothesis polynomial rather than exponential saturation retains sensitivity to unusually strong standardized signals without unbounded activations.",3cf130bf4032550dfb7bfb1b23e84bd33c1f356d5346510778b6c0af171318f3,754,0.7285401121697357,0.20070587940908902,1.119953241341101,0.21329247416664232,0.05305039787798409
0221,discard,"Closed-form neural readout refinement: after each200/600/1200 neural checkpoint, fit a penalty0.1 ridge readout on its eight clean hidden activations and monthly training labels; choose checkpoint by purged training MSE, full refit. Preserve feature-dropout hidden training and equal original-ridge blend/gate. Hypothesis solving the final layer directly reduces optimization error left by stochastic gradient training.",0534d0d60e12519326b29b248e915994fdbc21c9b5bb234ee6e40db604106382,754,0.6282415368072938,0.176955761704503,1.0184001814340409,0.2128954994037161,0.05305039787798409
0222,discard,"Joint hidden/raw closed-form readout: after dropout neural training, fit a penalty0.1 ridge on the concatenation of eight learned hidden activations and nine standardized original inputs. Purged train-only checkpoint choice, original ridge member/equal blend/gate unchanged. Hypothesis a jointly fitted linear path plus learned interactions improves calibration relative to freezing separate linear and neural readouts.",507a61600167ceb960cceab6aacbe4d7f05c832a87becac8687106f5c61e476a,754,0.5693433641607362,0.16255196277277228,0.947736422939182,0.21289549940371555,0.05570291777188329
0223,discard,"Gaussian variance-change scan gate: for trailing60 log returns, maximize zero-mean variance-segmentation likelihood ratio across candidate recent block lengths5/10/20/30, retaining only increases in recent energy. Use square-root statistic with training95/70 quantiles and original price-break/recovery conditions; dropout ensemble unchanged. Hypothesis scanning possible onset ages detects persistent volatility transitions missed by one fixed ratio. Statistic derived from Gaussian log likelihood; no external data.",3d8af0f1730fbacbf45c6b148827e3ddfc79509971f443a02a249b78299d13d4,754,0.5620146877498264,0.16073466744745502,0.9018423333566833,0.26727798536283565,0.04509283819628647
0224,discard,"Downward joint mean/variance change gate: maximize Gaussian two-segment versus pooled log-likelihood ratio over trailing60 returns and recent lengths5/10/20/30, retaining negative recent means. Use square-root score with original training quantile calibration and price confirmation. Hypothesis identifying a downward distribution shift captures sustained risk even when close-volatility ratios are moderate. Analytical Gaussian likelihood construction, training-only thresholds.",e74e0733b180f8c9f0f475856064b8382d77f63d6e766773c2b2cf2cf169abb6,754,0.6814323185599269,0.18966861161056903,1.0483848319924982,0.2672779853628353,0.04509283819628647
0225,discard,"Distribution-change forecast representation: add one-sided variance-change likelihood score, negative-mean joint-change score and largest absolute signed two-sample mean-shift statistic from trailing60 log returns to both dropout-neural and ridge forecasts. Keep original volatility gate and fixed equal blend. Hypothesis providing graded evidence of distribution shifts lets training learn when changes imply reversal versus continuation; all scans use past history only.",c0d179c8a0adc776f821359ab7874ea290f81f55982bd046d5a0a5b2eb4f087c,754,0.6108168120558883,0.1727311182356439,0.9785072747449055,0.21289549940371566,0.04509283819628647
0226,discard,"Regime-balanced neural training: form four training-only groups by price above/below SMA200 and volatility above/below fitting-sample median, then sample groups uniformly and observations uniformly within group. Keep feature dropout, monthly target, purged MSE checkpoint choice and original ridge/gate. Hypothesis giving rarer weak-trend regimes equal learning weight improves nonlinear decisions beyond predominantly rising-market training examples.",7fc78c13e985409fc8c86bdd849585fe99a46a62d59f33ffd04c93fbe36a14d3,754,0.36854727311702096,0.11055586960838504,0.695136821800084,0.21289549940371588,0.06896551724137931
0227,discard,"Chronologically stratified neural minibatches: split fitting rows into eight contiguous equal blocks and draw four observations per block for every32-example update. All blocks and rows remain within fitting prefix; original monthly labels, feature dropout, ridge blend and gate unchanged. Hypothesis each update seeing diverse training eras reduces gradient imbalance without changing the expected empirical loss.",aa2741a91082c032852cf6f89919e5e3e7b5790faa0d0c1aa69ce9608d9ae1c4,754,0.6287093990826158,0.17706877954275213,1.0177409894893503,0.21289549940371566,0.05570291777188329
0228,discard,"Loss-adaptive chronological neural sampling: split fitting rows into four contiguous blocks and sample blocks proportional to exponentially tracked standardized squared-error loss, clipped0.25..4, with within-block uniform sampling. Loss tracking uses only sampled training errors and starts equally. Preserve feature dropout, purged checkpoint choice and ridge/gate. Hypothesis spending more updates on persistently poorly fitted training regimes improves robustness to heterogeneous dynamics.",abe35a863c7b551a476a8c2a8d304cbe8c06bdf7cf2cccedff43fb116f9f3160,754,0.7075834899123461,0.19582083225751634,1.0951662608956307,0.21329247416664265,0.04774535809018567
0229,discard,"Causal singular-spectrum trend timing: form a lagged log-price trajectory matrix from latest64 closes, reconstruct rank2 signal by diagonal averaging, extrapolate one point using recurrent SSA coefficients and trade the reconstructed endpoint slope with fixed normalized hysteresis. Hypothesis low-rank trend/cycle extraction identifies persistent direction without selecting calendar regimes. Method source Golyandina/Korobeynikov, submitted2012-06-28, https://arxiv.org/abs/1206.6910 ; fixed rolling64 observations, lag16/rank2,40-step orthogonalized power approximation. Reconstruction is redone using past observations only.",648285a21181d987f3f5fac80b133a878a5278a2d4300c888ea82060470938c4,754,0.07165244052532782,0.02339798769755652,0.23322874712651698,0.2091639046707121,0.09283819628647215
0230,discard,"Causal singular-spectrum trend with shock gate: fixed rank2 recurrent SSA endpoint direction combined with original training-calibrated volatility-break gate. Hypothesis latent trend extrapolation and abrupt-risk detection cover different failure modes. Method source Golyandina/Korobeynikov, submitted2012-06-28, https://arxiv.org/abs/1206.6910 ; fixed rolling64 observations, lag16/rank2,40-step orthogonalized power approximation. Reconstruction is redone using past observations only.",a65a4b688604807807b20536a3793282b3972c9af8ebb33f99c71529a40713bb,754,0.16705890314271965,0.05298838404950068,0.449497073574435,0.16457898411000027,0.09283819628647215
0231,discard,"Singular-spectrum features for dropout ensemble: add reconstructed next-step slope, next forecast minus current observed log-price and explained trajectory energy fraction to both monthly ridge/neural inputs. Keep equal blend, purged training fitting and original gate. Hypothesis learned models can distinguish smooth latent continuation from endpoint noise using these features. Method source Golyandina/Korobeynikov, submitted2012-06-28, https://arxiv.org/abs/1206.6910 ; fixed rolling64 observations, lag16/rank2,40-step orthogonalized power approximation. Reconstruction is redone using past observations only.",ecc7eb3966643790391283a28d283d9029d303c8127920b00812c6d5db273148,754,0.6945185517884158,0.19275512861281952,1.0839627294806098,0.21329247416664288,0.04774535809018567
0232,discard,"Combine stochastic and exhaustive feature robustness: retain original ridge at50-percent forecast weight and split remaining50 percent equally between feature-dropout neural model and equal-averaged nine leave-one-feature-out neural models. Each neural branch chooses checkpoints on purged training MSE independently; weights fixed, gate unchanged. Hypothesis complementary regularization methods reduce branch-specific prediction errors.",b4f07d31f52552b244298f18eba42d770383ae31fd9d4865b3d3f64962bf910f,754,0.805483087461563,0.21831057686514987,1.2056780090760535,0.21289549940371544,0.058355437665782495
0233,discard,"Median aggregation of leave-one-feature-out experts: keep all nine deterministic masked-feature neural models and use their median prediction instead of mean, including during purged training checkpoint selection. Equal blend with unchanged original ridge and gate. Hypothesis an extreme forecast caused by removal of one important indicator should not dominate the ensemble.",85b87eee8d32f60ec5e3d71536d99ac07c752e401d0536403441c3f7c524475d,754,0.8043589045686261,0.21805699347881546,1.2049706857827012,0.212895499403715,0.0610079575596817
0234,crash,"Conditional-quantile neural expectation: train five shared-hidden monthly log-return quantile heads at probabilities0.1/0.3/0.5/0.7/0.9 using pinball loss and input dropout; average their daily-unit quantile predictions as a midpoint approximation to conditional mean. Purged training-MSE checkpoint selection, equal original-ridge blend and gate unchanged. Hypothesis learning return distribution shape reduces sensitivity to extreme labels compared with squared-error mean fitting.",e320f1baa6a75abc1e9600370aaadb0c7d19a52115260dd0c6bdb942d7d2aa7d,,,,,,
0235,discard,"Conditional-quantile neural expectation: train five shared-hidden monthly log-return quantile heads at probabilities0.1/0.3/0.5/0.7/0.9 using pinball loss and input dropout; average their daily-unit quantile predictions as a midpoint approximation to conditional mean. Purged training-MSE checkpoint selection, equal original-ridge blend and gate unchanged. Hypothesis learning return distribution shape reduces sensitivity to extreme labels compared with squared-error mean fitting. Correct the five-head bias-gradient buffer dimension; previous attempt crashed before evaluation. Small in-memory shape check verifies all five heads execute.",e75523957854dbd9d78974527ce259fd5c4730ff683cb676f84d848607ac6b3b,754,0.6811172743628024,0.18959410850395741,1.0607821026328812,0.21329247416664276,0.034482758620689655
0236,discard,"Return-priority risk-gate ablation: use the feature-dropout ridge/neural forecast and its original position hysteresis directly, without the external volatility gate. Frozen max-drawdown constraint remains50 percent in evaluator. Hypothesis the stronger learned forecaster may avoid sufficient losses by itself while the gate suppresses profitable high-volatility exposure; no model or protocol changes.",f3287fc11af0f08f122df9382b33230163ae3c9476c62431091fa2319e09051e,754,0.3729139551571947,0.11173891293361593,0.6266711594645914,0.3223653655578401,0.03978779840848806
