attempt,status,description,strategy_sha256,days,total_return,annual_return,sharpe,max_drawdown,mean_turnover
0237,discard,"Partial exposure during volatility alarms: preserve dropout ensemble decisions and original risk-state transitions but retain half of the forecast-requested index position while the shock gate is off. Fully exposed when gate on, never leveraged. Hypothesis accepting more risk within the fixed50-percent drawdown cap can preserve rebound participation rather than forcing all alarm periods to cash; one predetermined midpoint exposure, not a validation grid.",e08d5e1f41548b85cef883e4008cf09470fb98a1d8cc37be4895d72f50301eb6,754,0.5817049309079294,0.1656045058212856,0.9274126032260438,0.24047248243299735,0.04934980857776862
0238,discard,"Continuous variance-scaled alarm exposure: preserve dropout forecast and risk-state transitions; when gate is off, multiply requested exposure by min(1,(training recovery ratio/current short-long volatility ratio)^2), restoring full exposure when gate turns on. Hypothesis proportional risk reduction uses magnitude of the alarm and retains some positive-forecast participation while respecting0..1 holdings.",d33addeac5738a1ba5d0a0c30abb5f6b4ff997db9349711fc1282a3680908714,754,0.759420582663773,0.20783285442249766,1.1414321015337727,0.2353755160408172,0.05590573073291109
0239,discard,"Era-demeaned neural training labels: within each fitting call, split monthly labels into four contiguous blocks, subtract each block mean and restore the overall fitting mean before neural optimization. Evaluation/early stopping still compares predictions with untouched later-training labels. Original ridge and gate unchanged. Hypothesis suppressing era-specific return-level shifts encourages reusable within-era nonlinear patterns instead of incidental era correlations.",c8f12299571af9a9c71edc4484a62fea023c42c4acea6ea992b251316692bc8e,754,0.7691312909046517,0.21005678405959682,1.1679334928981895,0.21289549940371566,0.05570291777188329
0240,discard,"Within-era fixed-effects ridge slopes: estimate ridge covariance and cross-moments after demeaning standardized features and monthly targets inside four fitting-only chronological blocks; deploy slopes around full-fitting feature means and global target mean. Neural dropout branch keeps original labels/normalization, equal blend and gate. Hypothesis separating era intercept shifts from predictive slopes improves transfer of the linear member.",152a33f6d6fcc0361f9722be645f2baf1b5182ae1e8c3470abae52395d2ee739,754,0.7696466452239905,0.2101745822698915,1.1693367171875113,0.21289549940371522,0.058355437665782495
0241,discard,Combined era-adjusted forecasting: fit ridge slopes from within-era centered feature/target moments and train dropout neural model on block-demeaned monthly labels with global mean restored. Each fitting call derives its own four blocks entirely inside its training prefix; preserve purged original-target checkpoint evaluation and gate. Hypothesis removing nuisance era levels in both branches improves stable conditional-return estimation.,bdcb098f772ad4f02a7dc1b79306cf4cb2ddce4bd77715f6c89900ded3211e35,754,0.763883527286124,0.20885596247118587,1.1667609837365502,0.21289549940371577,0.0636604774535809
0242,discard,"Depth-two symmetric gradient boosting: fit monthly mean-log labels with up to120 additive depth2 trees, choosing global symmetric splits from fitting-only feature quartiles, minleaf40, leaf shrinkage50 and learning rate.05. Choose20/60/120 trees by purged training MSE; original shock gate. Hypothesis learned two-feature interactions overcome the limited expressiveness of earlier boosted stumps.",e3645c84d00d5d5a225d388969f317ae5bf1d5d008c72b48384fae93c46f7531,754,0.5628803064273582,0.1609496105709105,0.9146181756139186,0.21329247416664254,0.021220159151193633
0243,discard,"Ridge and depth-two boosted-tree forecast blend: equal-average independently training-selected monthly ridge and symmetric depth2 boosting predictions, preserving original hysteresis and gate. Boosted trees use fixed minleaf40/shrinkage50/rate.05 and purged train checkpoint selection. Hypothesis local threshold interactions provide a complementary predictor to global linear slopes.",5657f32acbb1804f28213d5c423c8fd4a481fa106f23378ba6fb595566bc35aa,754,0.5866932541788468,0.16683181545713066,0.9468741406467,0.21329247416664254,0.023872679045092837
0244,discard,"Robust depth-two boosting ensemble: clip boosting pseudo-residuals at1.345 times fitting-target standard deviation, with otherwise identical symmetric-tree construction, purged training checkpoint selection and equal ridge blend. Hypothesis bounded residual influence prevents unusual training episodes from dominating interaction splits.",36121a4ed4e360d3fb6829dd3e0f964eca85109a8d5fc8a4605890ea6ec21a4f,754,0.5628803064273582,0.1609496105709105,0.9146181756139186,0.21329247416664254,0.021220159151193633
0245,discard,"Volatility-unit neural targets: divide each monthly mean-log training target by its observation's trailing20 close volatility, fit the dropout neural predictor in those units, and multiply its forecast by the current observable volatility at inference. Select checkpoints against original-unit labels on purged later training data. Original ridge and shock gate unchanged. Hypothesis predicting standardized reward separates direction from changing return scale.",1dd590ce1df97cd3c2da1cf4c2acc0c31530a7eed3721def0f54f40ad92caa65,754,0.6980907858925396,0.19359491638324133,1.0811473256130681,0.21329247416664254,0.042440318302387266
0246,discard,"Heteroskedastic neural loss weighting: retain original return units but weight neural squared errors inversely to current trailing20 volatility squared, relative to fitting-sample median and clipped0.25..4 then mean-normalized. Keep dropout, purged unweighted MSE checkpoint choice, ridge blend and gate. Hypothesis bounded variance weighting prevents noisy observations from dominating conditional-mean estimation without altering prediction units.",f23c4707136a600e7476bed277a94d31ca3ffa39229a625c3ff6b69c9418fb10,754,0.8019076866102435,0.21750370412623576,1.1998850018617178,0.21329247416664243,0.05570291777188329
0247,discard,"Global training mixup with feature dropout: convexly combine pairs of standardized training examples and their monthly targets using Beta(.2,.2) coefficients, then apply original input dropout. Independent augmentation RNG preserves primary minibatch selection; clean inference, purged checkpoint choice and ridge/gate unchanged. Hypothesis enforcing smoother behavior between training states improves generalization. Source Zhang et al., submitted2017-10-25, https://arxiv.org/abs/1710.09412 .",1b7748c997658f540452d710164f03f70d484434ffc7694ce30d1dd33cd4eb1b,754,0.7392108711171439,0.20317812337549834,1.1357946367726466,0.21289549940371633,0.0610079575596817
0248,discard,"Time-local training mixup: constrain each paired example to within20 training rows of the original before convex feature/label interpolation, retaining Beta(.2,.2), dropout and other original settings. Hypothesis local interpolation avoids unrealistic mixtures of distant market regimes while smoothing overlapping monthly targets. Adaptation of Zhang et al., submitted2017-10-25, https://arxiv.org/abs/1710.09412 ; pairs never cross the fitting-prefix boundary.",b89c708559b0b5fdf1ee553c5602c65182510953654d6445b3050be2771f7dd4,754,0.5628803064273582,0.1609496105709105,0.9146181756139186,0.21329247416664254,0.021220159151193633
0249,discard,"Adversarial feature smoothing during neural training: after dropout, perturb each active standardized feature by0.05 along the sign of its current squared-error gradient, then train on the perturbed input; masked features remain zero, inference remains clean. Original ridge/gate and purged checkpoint selection. Hypothesis reducing sensitivity to worst-direction small indicator errors improves stability. Method inspiration Goodfellow et al., submitted2014-12-20, https://arxiv.org/abs/1412.6572 ; regression adaptation.",062581e4e67dfe615cf7895a8c9f20146e107ff1f10caf42e39aea2c7604efdc,754,0.6811172743628024,0.18959410850395741,1.0607821026328812,0.21329247416664276,0.034482758620689655
0250,discard,"Bipower shock gate: use square-root adjacent absolute-return products for short/long volatility ratio with unchanged train95/70 calibration and price confirmations. Hypothesis persistence-sensitive volatility separates repeated stress from isolated moves. Ridge/dropout forecast unchanged. Source Barndorff-Nielsen and Shephard (2004), https://shephard.scholars.harvard.edu/publications/power-and-bipower-variation-stochastic-volatility-and-jumps ; daily-frequency heuristic, not an intraday jump estimator.",740dead72bd79ca15777ccf0250f26f88ac2964a72bea83d0e8762c80e697bc0,754,0.7238455069542473,0.19961499555777684,1.112281768437967,0.25851222163818177,0.05305039787798409
0251,discard,"Bipower state features: append nonnegative variance-minus-bipower shares over20/60 daily returns and short/long bipower ratio to both predictors. Hypothesis distinguishing isolated moves from persistent variation adds predictive state information. Original gate and training-only tuning retained. Source Barndorff-Nielsen and Shephard (2004), https://shephard.scholars.harvard.edu/publications/power-and-bipower-variation-stochastic-volatility-and-jumps ; daily-frequency heuristic, not an intraday jump estimator.",bc7969a60484314d2c7c1e5348de2d62142ca61ffc3f0811a3f49870580d2160,754,0.6517219826569693,0.18260127703561713,1.0421157865341357,0.21289549940371544,0.06896551724137931
0252,discard,"Bipower feature normalization: scale existing momentum/trend features with adjacent-product volatility instead of standard deviation, preserving all other modeling and gate choices. Hypothesis isolated extreme returns distort ordinary volatility normalization. Source Barndorff-Nielsen and Shephard (2004), https://shephard.scholars.harvard.edu/publications/power-and-bipower-variation-stochastic-volatility-and-jumps ; daily-frequency heuristic, not an intraday jump estimator.",cafff3d8ad60878c83340f2f7fd6ddcdf04e4e79d40d30b880ae6d6f8635855b,754,0.7708407418112151,0.2104474376960097,1.172840184801474,0.212895499403716,0.058355437665782495
0253,discard,Moving-block bootstrap neural ensemble: fit five dropout networks to fixed-seed resamples of contiguous20-observation training blocks and average their forecasts. Choose training duration on the original purged training suffix before resampling; retain original ridge/gate. Hypothesis preserving overlapping-label dependence while resampling whole episodes reduces nonlinear estimator variance. Own adaptation; no validation fitting or seed selection.,074b14c211d72478504bf83609b16808ba7220a81190c53e426bcea432b94fbd,754,0.7087935204968123,0.19610397621060227,1.095332067608192,0.21289549940371544,0.05305039787798409
0254,discard,"Empirical Gaussian-rank neural targets: map monthly training returns to normal quantiles, fit the dropout network, then invert predictions through training empirical quantiles. Checkpoint selection still uses original-unit errors on the purged later training suffix. Original ridge/gate. Hypothesis rank estimation is less dominated by extreme target magnitudes; inverse mapping is a robust location heuristic rather than guaranteed conditional mean.",1e06d9af8c5ebd910f6c9caa82182acc6bc9def6ae3b2d04aee2bf21a12e75e3,754,0.5894324050680118,0.167504654254385,0.9470440217183339,0.213292474166642,0.023872679045092837
0255,discard,"Hidden-direction decorrelation: add squared pairwise inner-product penalty on nonbias neural hidden weights, coefficient0.001 in the gradient, alongside original dropout and weight decay. Original ridge, clean inference, purged checkpoint choice and shock gate retained. Hypothesis discouraging redundant hidden projections preserves complementary nonlinear representations when indicators are correlated. Own regularization hypothesis.",f095ef2355a9123aa9dac4b4a7cc28809145e0a0e7d49500b8a243701a830169,754,0.8097729659045891,0.2192772854581111,1.2102117319231382,0.21289549940371577,0.058355437665782495
0256,discard,"Multiscale variance-ratio features: append log variance ratios for2/5/20-session overlapping returns against126-session daily variance to both ridge and dropout neural predictors. Hypothesis return dependence across horizons distinguishes persistent from reversing paths. Original training-only fits and gate unchanged. Inspired by Lo and MacKinlay (1988), https://web.mit.edu/~alo/www/Papers/lo-mackinlay-88.html ; descriptive rolling ratios, not significance tests.",8cda6ab64d9a2333776816ff5826ff3eee71d69c3579f7fd54bf69bcee7b0c6d,754,0.37133309245156987,0.11131090740223293,0.7004519689802633,0.21289549940371633,0.050397877984084884
0257,discard,"Dependence-conditioned momentum: augment variance-ratio features with products of each log ratio and its corresponding short/monthly normalized return feature. Hypothesis explicitly conditioning momentum on serial dependence lets a shallow model express trend-versus-reversal regimes. Original ensemble/gate and purged fitting. Inspired by Lo and MacKinlay (1988), https://web.mit.edu/~alo/www/Papers/lo-mackinlay-88.html ; descriptive rolling ratios, not significance tests.",16bfd3cbcbdc318c66e0188272b53bce0f9340483c625b84c40a8f3b7b648e7a,754,0.42189490249904593,0.12484062693160314,0.7726491233999626,0.21289549940371544,0.0610079575596817
0258,discard,"Variance-ratio regime rule: when rolling5-session variance ratio exceeds unity, follow21-session momentum; otherwise trade against5-session momentum. Use dimensionless0.1 hysteresis and original training-calibrated shock gate. Hypothesis adapting direction to observed persistence works without a fitted return predictor. Inspired by Lo and MacKinlay (1988), https://web.mit.edu/~alo/www/Papers/lo-mackinlay-88.html ; descriptive rolling ratios, not significance tests.",47294c463c539fa6219f09fbfa11842f6823323b8cb076fc398561086d9e4a7b,754,0.3904971114869169,0.11647743713194103,0.907368016505824,0.20758162134626357,0.15915119363395225
0259,discard,"Execution-aware neural early stopping: select200/600/1200 training steps by simulated net log growth of the ridge-plus-dropout ensemble on the later30-percent training suffix. Fit the companion ridge and shock thresholds strictly on earlier training rows; retain21-row purge, next-open labels, drifted turnover costs and terminal liquidation. Full refit after choosing duration. Hypothesis prediction MSE can select a checkpoint with inferior trading decisions; no validation fitting.",07231ede0abc81251669c3999310992ad8b92df4d31f3138ba9b36be5e2d8a11,754,0.5715653227618356,0.16310182637784498,0.9519629824030693,0.21289549940371622,0.04774535809018567
0260,discard,"Expanding-fold execution-aware early stopping: select neural duration by summed ensemble net log growth on three chronological20-percent training windows following40/60/80-percent prefixes. Refit ridge, dropout neural snapshots and shock calibration on each purged prefix; charge costs and liquidation separately per fold. Refit selected duration on all training data. Hypothesis averaging sequential trading outcomes is a more stable early-stopping criterion than a single MSE suffix.",17a98b688d0f1eadefad191d2f521ec63390b624486ca2c7800772e732af3757,754,0.5715653227618356,0.16310182637784498,0.9519629824030693,0.21289549940371622,0.04774535809018567
0261,discard,"Adam neural optimization: replace plain stochastic gradient updates with bias-corrected first/second gradient moments, default learning rate0.001 and beta0.9/0.999. Retain coupled weight penalty, dropout, initialization, minibatches, purged MSE checkpoint selection and ridge/gate. Hypothesis adaptive scaling fits nonlinear indicators more effectively under the fixed training budget. Kingma and Ba, submitted2014-12-22, https://arxiv.org/abs/1412.6980 .",d3fa6b9dd4c6ddb84db7ed01c609a98b2252e561f61c51e8f1c4165678d7d5c3,754,0.6900149609298616,0.19169470906899355,1.0722500804394277,0.2132924741666431,0.03978779840848806
0262,discard,Smoothed-gradient neural optimization: use bias-corrected exponential gradient averaging with0.9 memory while retaining original decaying learning rate and penalties. All other dropout ensemble choices unchanged. Hypothesis reducing minibatch gradient noise improves convergence without coordinate-wise adaptive scaling. Own optimizer comparison; training-only checkpoint selection.,a6b460a8ceeb9ce2f1e02ff1b1e95877abcde624ef101488e64d1096341f7c29,754,0.6843825238388306,0.1903658391804759,1.0667215780860055,0.2132924741666422,0.03978779840848806
0263,discard,"Dropout-distribution inference: average64 fixed-seed feature-masked neural predictions per observation, with the same10-percent inverted masking used in training. Use this averaged prediction both for purged training checkpoint selection and deployment; keep ridge/gate unchanged. Hypothesis integrating nonlinear masked predictions better matches the training objective than feeding only mean inputs. Reuse identical masks for every observation; no seed search.",9bcb833b8c74bb9dd674ab2a776ad7871b524eebfebc360f0f2862c72caaa5e2,754,0.7412953479708098,0.20365988340508112,1.133463143545422,0.21329247416664265,0.05305039787798409
0264,discard,"First-passage neural labels: replace fixed monthly targets by average forward log return up to the first cumulative move of either sign reaching twice current daily volatility, capped at20 sessions. Use only training forward returns and purge21 rows before checkpoint evaluation. Original ridge and daily reallocation/gate remain. Hypothesis early directional resolution is more predictable than a fixed calendar endpoint. Own event-label adaptation; barriers define training labels, not hindsight execution.",75bacb0879025bb2bd320b344223d4ae990cfd694255792bf7d4f24d763c285a,754,0.3560546532370368,0.10715736586120572,0.7407470444683542,0.1854509350052025,0.07161803713527852
0265,discard,"Variance-clock neural labels: accumulate training forward squared log returns until reaching20 times current observable daily variance, capped at60 sessions, and predict average log return over that interval. Purge61 rows for all checkpoint fitting; original ridge and actual daily execution unchanged. Hypothesis a comparable amount of market variation defines more stable prediction targets across quiet and active states. Own event-time labeling hypothesis; future observations are confined to training labels.",36aa6b815944e3dc2a317dbb75dfd4e7b88801720104f9f81c7a1cb3c1eb0c6a,754,0.37745199885011926,0.1129657308110612,0.7224187246941204,0.20109786147239261,0.034482758620689655
0266,discard,"Robust trend replacement: substitute normalized median pairwise log-price slopes for the5/21/63-session endpoint momentum inputs, keeping all other ridge/dropout features and gate unchanged. Hypothesis using the full path reduces sensitivity to arbitrary endpoints and isolated moves. Training-only fitting retained. Trend estimator: Sen (December1968), https://doi.org/10.1080/01621459.1968.10480934 .",a9802c2064a80996463efe2221ba90485f4c0c548b9c6de3e0ee349d95fb8b25,754,0.7784616539306908,0.21218596469650808,1.178415266892845,0.21289549940371533,0.0610079575596817
0267,discard,"Robust trend geometry features: append21/63-session median pairwise slopes, deviations from the fitted endpoint and pairwise directional concordance. Hypothesis trend strength, overshoot and consistency jointly distinguish continuation from reversal. Original ensemble and shock gate retained. Trend estimator: Sen (December1968), https://doi.org/10.1080/01621459.1968.10480934 .",ee1b8006d9d7b331d984d215e622108eb339b30c34283e9c98dad2edb27c017d,754,0.6892439706969198,0.19151298246974413,1.0845096390756113,0.21289549940371577,0.06896551724137931
0268,discard,"Standalone robust monthly trend: invest when the normalized21-session median pairwise log-price slope exceeds0.05, exit below-0.05, otherwise retain position; multiply by the original training-calibrated shock gate. Hypothesis a robust path trend can provide a simpler directional rule than supervised forecasts. Trend estimator: Sen (December1968), https://doi.org/10.1080/01621459.1968.10480934 .",aaf7b7709c558c2c7926db27d70d7f9931d3443a6aec12ba84a589dedd1569cf,754,0.13014960251373586,0.04173908857851849,0.3808070184585832,0.20351868259627004,0.03978779840848806
0269,discard,"Representation ablation, robust neural only: give the dropout network median-pairwise5/21/63-session log-price slopes while preserving the original ridge endpoint-momentum representation. Keep equal forecast blend, purged training fits and gate. Hypothesis robustness helps nonlinear estimation while the linear predictor benefits from endpoint sensitivity; isolates the two components of the prior joint replacement. Sen (December1968), https://doi.org/10.1080/01621459.1968.10480934 .",c2b9a214ba01ea51c8a089748bdab43e38c509396996c98e0bb3058b3e948599,754,0.7654644101883159,0.2092179586793257,1.164654959422578,0.21289549940371577,0.0610079575596817
0270,discard,"Representation ablation, robust ridge only: give ridge the median-pairwise momentum slopes and leave dropout neural inputs unchanged. Retain equal blend, training-only checkpoint and ridge selection, and gate. Hypothesis a smooth robust linear forecast complements the nonlinear predictor's endpoint sensitivity; reciprocal component ablation rather than a blend-weight search. Sen (December1968), https://doi.org/10.1080/01621459.1968.10480934 .",821b66cfe4ee8fc398cff0a6866819b4189e71f1e09099664459f5402ef46525,754,0.7107935595837513,0.19657168753667453,1.098698159980461,0.21289549940371566,0.05305039787798409
