attempt,status,description,strategy_sha256,days,total_return,annual_return,sharpe,max_drawdown,mean_turnover
0052,discard,Equal-weight weekly/monthly/quarterly forecast ensemble: 5/20/60-session mean log-return ridge models independently selected by purged chronological training CV; average daily-return forecasts before cost hysteresis and risk gate. Hypothesis: horizon diversification reduces dependence on a single label scale.,d421289ef8323a7e4f5d28b64451337d91a4c114b2397294860bdf2daa2a8b76,754,0.7148146337221668,0.19751091956839684,1.109246410472522,0.21289549940371466,0.06631299734748011
0053,discard,"Monthly model with partial exposure during negative forecasts: retain half index weight when forecast turns negative, while acute volatility protection can still go fully to cash. Hypothesis: forecast sign is noisy and partial participation reduces missed recoveries without weakening shock exit.",b8671d39ed47e1c7aaddc7b2654cc058f8d19a2cfa2e06cf4f601742e2cb2c10,754,0.6394288530908421,0.17965229466991461,1.0178374921108961,0.21289549940371655,0.04124803048808463
0054,discard,"Robust monthly ridge labels: clip training target tails at fitting-subset 2.5/97.5 percentiles, separately within each purged CV fit and final refit. Evaluation labels remain unchanged. Hypothesis: a few extreme training windows may dominate mean-square estimation and harm transferable forecasts.",e817bf0ce83dee87afbe7e5c9c4dc4560815d77ebe0fd41622deb30cb51ae987,754,0.7102479718773436,0.19644413737949318,1.0970129300696045,0.212895499403715,0.050397877984084884
0055,discard,"Decision-focused training CV: choose monthly ridge penalty by chronological training-fold net portfolio growth under existing cost/risk rules rather than forecast MSE. Purge 21 rows, calibrate risk thresholds only on earlier fold; outer validation policy untouched. Hypothesis: prediction loss and invest/cash decisions need not select the same model.",d66264e87e39dd07afd2bdc6ee369313784e8be98435047651f841fb631d9896,754,0.7179227936008303,0.1982359111898464,1.1118165791467698,0.21289549940371533,0.0610079575596817
0056,discard,"Block-bagged monthly forecasts: twelve ridge models fitted to fixed-seed 40-session moving-block resamples of training feature-label pairs, ridge penalty selected by original purged training CV; average predictions with same gate. Hypothesis: block resampling reduces sensitivity to particular overlapping monthly targets while respecting training-only fitting.",2577ce86f5f8e697993aa232923d2d277004aa4544ef7ae344961c5309a55781,754,0.47917222029731277,0.13978579471431019,0.8369793789261813,0.21289549940371566,0.050397877984084884
0057,keep,"Monthly forecast close-only ablation: retain normalized return/trend/volatility/drawdown inputs, remove four daily OHLC candle features. Same training CV and gate. Hypothesis: single-day intraday structure may add noise to a 20-session target.",7cbd131aa14077b6b8190832bcf0f77d41aea12649545d702deddce9625ec946,754,0.7353732484758473,0.20229017354930723,1.1319600614103944,0.21289549940371577,0.0636604774535809
0058,discard,"Monthly forecast using technical indicators: replace feature set by fixed RSI2/14, MACD12/26/9 levels/histogram, Bollinger20 normalized position/width, monthly/six-month momentum and 5/60 volatility ratio. Frozen indicator library, all trailing observations; same purged training CV and gate. Tests smooth path information rather than single-bar structure.",da04f3ee79e5d57d1f5772fc1f5ffc4b69947443539be84dd52d7a975e8dd408,754,0.5567095089417444,0.15941559473618505,0.9248743331871115,0.212895499403716,0.04774535809018567
0059,discard,"Technical-indicator augmentation of monthly forecast: append fixed RSI2/14, normalized MACD and Bollinger20 location/width to existing 13 causal features. Same training-only penalty selection and risk gate. Paired with replacement ablation to distinguish complementary from redundant information.",7fede5a5670756d29cc4294115c1ac95e815bb4c73cf80209360b4f3b9a6e39a,754,0.7123424461265857,0.19693364628089305,1.1081228720700744,0.212895499403716,0.0610079575596817
0060,discard,"State interaction features for monthly ridge: add reversal-times-trend and momentum-times-volatility interactions plus squared short reversal and drawdown. Coefficients fitted only on training, purged penalty CV retained. Hypothesis: linear forecast can miss differing reversal behavior across trend/risk states.",41bb4edb6acf5db0d3744f401c0daf696e067bd9209f203471e3ed182555258b,754,0.6188044365785745,0.17467148403444455,1.0008667033667897,0.21289549940371566,0.050397877984084884
0061,discard,"Overnight/intraday decomposition features: append trailing 5/20-session mean close/open and open/previous-close log returns normalized by daily volatility. Current and historical OHLC only, all observed by signal close. Hypothesis: persistent gap and session components contain different information for monthly returns.",e2c3fea4897e4545eed700d7f2edb1df7caecea4176d09ca31a6def38e8801f3,754,0.6736325873203335,0.18782135472279893,1.0632360832182517,0.212895499403715,0.058355437665782495
0062,discard,"Raw-scale monthly forecast ablation: use unnormalized log returns over 1/5/21/63/126 sessions, moving-average distance, drawdown and realized volatility. Same train scaling, purged ridge selection and risk gate. Hypothesis: volatility-normalizing every trend feature can remove economically relevant magnitude information.",d3497d74094da35085d371dd2736a48bec85bfb3edc3798e9ef98edda2486594,754,0.5422743906380147,0.15581124801271407,0.936094532545257,0.20109786147239272,0.0610079575596817
0063,discard,"Recency-weighted monthly ridge: exponentially weight training observations with 504-session half-life in centering, scaling, target mean and least squares, separately inside each purged CV fit. Same close-only features and fixed risk gate. Hypothesis: relationships drift, so recent training evidence should count more without discarding older observations.",023263eb25e6a888e157d0a83e8dfeb73cf3f910fc4d55b38c2a1cc53363c5ff,754,0.6878098866668729,0.19117481410976822,1.0790546610295035,0.21289549940371533,0.05570291777188329
0064,discard,"Trailing-training-window monthly model: each training-model fit uses only its most recent 756 labeled samples; purge/CV and frozen outer protocol unchanged, risk calibration still uses all available training rows. Hypothesis: recent three-year relationships may transfer better than a decade average.",67da1baa5b620e7782e5d1700d85b8f71089593b462c83e2b80b91806a14ecf4,754,0.6389814773986333,0.17954469709653864,1.0139712164499564,0.2132924741666432,0.03713527851458886
0065,discard,"Equal blend of full-training and last-756-sample monthly ridge estimates: select shared regularization with purged chronological CV using blend predictions. Same gate. Hypothesis: preserve long-run evidence while adapting to recent relationships, reducing sensitivity to either training window alone.",766a78247359d823f5fb51cc8eb70184dfec779a4e05d0eb377354c228ea92db,754,0.6970635330798269,0.19335354261625093,1.082236326044197,0.213292474166643,0.04774535809018567
0066,discard,"Trend-conditioned monthly ridge mixture: fit separate above/below SMA200 regressions plus a pooled model; blend local and pooled forecasts equally, fallback if a group has fewer than 180 training samples. Selection via same purged training CV. Hypothesis: conditional trend regimes have distinct return relationships; no calendar rules.",6d0c5b7d70f69e7c07ed92cda2903100a74c300aff5f3f88173eb9fe825e48c7,754,0.7290545124909917,0.20082529047700315,1.126683601474952,0.212895499403716,0.0610079575596817
0067,discard,"Shrunk nearest-neighbor monthly forecast: 100 nearest training feature vectors in standardized close-only state space, 100 pseudo-observations of global training mean, 20-session training labels. Same cost hysteresis and risk gate. Hypothesis: local state analogues can capture nonlinear relationships missed by a single regression.",09092608ad6b9086d1e03c2ac11d6ae2a1d62194788a35b247deb89af2b4d48f,754,0.5628803064273582,0.1609496105709105,0.9146181756139186,0.21329247416664254,0.021220159151193633
0068,discard,"Shallow forest on monthly labels: reuse fixed 24-tree depth-3 architecture with 50-observation shrinkage, now fit training 20-session mean log returns using close-only features. Same gate. Method source Gu/Kelly/Xiu RFS May 2020 https://doi.org/10.1093/rfs/hhaa009 ; tests whether longer labels enable useful nonlinear interactions.",1b59c423f6e72b22944730ee0f788f5aa1445012d5dd8831dd4c4d6c6bed2f9c,754,0.5628803064273582,0.1609496105709105,0.9146181756139186,0.21329247416664254,0.021220159151193633
0069,discard,"Method source Friedman, October 2001, https://doi.org/10.1214/aos/1013203451 . Monthly gradient-boosted stumps: additive residual fitting, learning rate .05, minimum leaves 60, leaf shrinkage 20; choose 20/60/120 stages by purged chronological training MSE and refit. Same risk gate. Hypothesis: additive nonlinear effects may be suppressed by bagged shallow forests.",47abb97ec41dda34b9b6c787f19b333d5784bafd39decf55baa7b840c28b5620,754,0.5628803064273582,0.1609496105709105,0.9146181756139186,0.21329247416664254,0.021220159151193633
0070,discard,"Method source Friedman, October 2001, https://doi.org/10.1214/aos/1013203451 . Boosted monthly forecast without shock gate: paired ablation of independently learned nonlinear return timing, all training selection unchanged. Tests whether forecast alone learns useful stress behavior.",09c7dcb57bc14f422786170a8569045958ea62d4c86b1b0a26b67e2727b4316c,754,0.1856184302443582,0.05855564884231668,0.38009334882608753,0.3223653655578401,0.002652519893899204
0071,discard,"Method source Friedman, October 2001, https://doi.org/10.1214/aos/1013203451 . Robust gradient-boosted monthly forecast: clip pseudo-residuals at 1.5 fitting-subset target standard deviations (Huber-style gradients); training CV chooses number of stumps. Same shock gate. Hypothesis: limiting influence of extreme overlapping training windows can improve nonlinear generalization.",f87e6989dd87466e5950f07ed1a0f21c29679daa0185d394c655d3da6fa05f1e,754,0.5628803064273582,0.1609496105709105,0.9146181756139186,0.21329247416664254,0.021220159151193633
0072,discard,"Method source Friedman, October 2001, https://doi.org/10.1214/aos/1013203451 . Weekly gradient-boosted forecast with shock gate: five-session average log-return target, six-row purge and horizon-scaled cost hysteresis, training CV selects stage count. Hypothesis: nonlinear short-horizon structure may survive where prior linear weekly model did not improve.",14c168bf60b818a21870c9af412644a9d905f9efdba0b05ff7384acddb1f5917,754,0.5628803064273582,0.1609496105709105,0.9146181756139186,0.21329247416664254,0.021220159151193633
0073,discard,"Method source Friedman, October 2001, https://doi.org/10.1214/aos/1013203451 . Linear forecast plus boosted residual corrections: initialize each training fit with fixed ridge .1, then train additive stumps on remaining error. Purged chronological training CV selects correction stage count. Same close-only features and shock gate. Hypothesis: preserve smooth extrapolation while correcting systematic nonlinear residuals.",2b9c6c7db60194c1a305fbed43ec254f3dedb1e7fdae13e3c46ca6b470d78b21,754,0.4769353588275129,0.13920943775817696,0.8428361812235314,0.20109786147239328,0.050397877984084884
0074,discard,"Smooth monthly forecasts before position decisions: five-session-span EMA of successive causal forecast values, unchanged cost hysteresis and instantaneous shock gate. Hypothesis: overlapping monthly targets should not cause daily position reversals on forecast noise.",7ee31c16a5fe449cd9737ad8066fc51cebfe204a2e10ba44191d4a11fbbb3f79,754,0.6755351632991986,0.18827248080045922,1.0702319130283788,0.21289549940371588,0.03713527851458886
0075,discard,Two-observation forecast confirmation: require two consecutive forecasts beyond the entry/exit cost threshold before changing forecast position; keep acute-risk gate daily. Hypothesis: simple persistence confirmation reduces spurious forecast sign flips without imposing a fixed holding period.,8712eaf364e5c60b2f9261b47748a092966deea89e07a4840ffc896daef4b263,754,0.6025962682432924,0.1707274707709896,0.977449388112932,0.2132924741666421,0.03978779840848806
0076,discard,"Staggered-sleeve forecast allocation: equal average of last five binary forecast recommendations, padded initially by current recommendation, multiplied by daily acute-risk gate. Hypothesis: spreading discretionary changes across independent daily sleeves reduces timing sensitivity and turnover; no calendar schedule.",59d4ea46e15e6b207014d1c8ea3bb6c0f34e6caf71f4b1dc01153b5d67f2e678,754,0.5620487157273317,0.160743118484878,0.9405098345055606,0.2128954994037161,0.04723230395726079
0077,discard,"Continuous approximate log-growth allocation: interpret monthly forecast as daily log drift; combine with trailing 20-session return variance to set clipped weight 0.5+mu/variance, then apply acute-risk gate. Hypothesis: smooth exposure can use forecast magnitude instead of only its sign; strictly zero to one exposure.",2433a5838fcc5e991e487f46b829c193dbd17253e658be2172fca1f74587002d,754,0.6244864799640952,0.17604789783202146,1.0331419934304529,0.21289549940371544,0.08581625656529915
0078,discard,"Decision-focused joint training calibration: select ridge penalty and four prespecified cost-derived hysteresis widths (zero, round-trip/20, one round-trip, two round-trips) by purged chronological training net growth subject to 50% DD. Calibrate gate only on earlier fold, refit model on training; never select threshold using validation labels.",5c9e9ab425527561a80db3915c4e7ebe507b8cd6be41b8dfdb2432c706cfae45,754,0.5628803064273582,0.1609496105709105,0.9146181756139186,0.21329247416664254,0.021220159151193633
0079,discard,Volatility-standardized monthly training target: divide forward mean log return by signal-time trailing 20-day volatility before ridge fitting and purged CV; multiply forecast back into daily log-return units before fixed cost threshold. Same risk gate. Hypothesis: normalize heteroskedastic target scale rather than only input features.,41b3d99d3a793ef69ce755b1b5388b7a7b96e2630a7b238ac01fb1ffdc264f24,754,0.5628803064273582,0.1609496105709105,0.9146181756139186,0.21329247416664254,0.021220159151193633
0080,discard,"Monthly residual-to-trend target: fit future daily log return minus currently observed 63-session average log drift, restore that baseline at inference. Same purged training selection and shock gate. Hypothesis: predicting departures from a causal trend baseline may be easier than predicting unconditional returns.",6242a8ab5ce07d0edc40d57a21e1f75def9184b4a6a59bd1d39d14949aae1f0c,754,0.15478731646752197,0.04927485222869166,0.38142443699903544,0.30103540744777535,0.06896551724137931
0081,discard,"Downside-weighted monthly ridge: give negative monthly training outcomes double weight in fitted moments and least squares, with regularization still selected by unweighted purged training MSE. Outer reward unchanged. Hypothesis: a deliberate downside-sensitive forecast may avoid harmful optimistic estimates while retaining the acute-risk gate.",63926951a6025611740abf3eb33af516b96c282549d2d4853397e67abaf42d6d,754,0.4040491945417344,0.12010246526579516,0.8114632195567344,0.17672766223803127,0.03978779840848806
0082,discard,"Nonoverlapping-phase monthly ensemble: train twenty ridge regressions, each sampling every twentieth labeled row at a different offset; average predictions. Each component has nonoverlapping 20-session targets. Same purged chronological training CV and acute-risk gate. Hypothesis: reduce repeated-window influence without selecting a calendar phase or discarding most observations overall.",4ee3fcb76f4df497a26f22c20ce6c74b67e9d91f5dad90d1136fdb80b9c1119e,754,0.715418107386782,0.1976517507904174,1.1105312990272491,0.21289549940371577,0.0636604774535809
0083,discard,"Locally adaptive volatility-shock gate: derive 95/70 ratio percentiles from strictly earlier rolling windows within current 252-session history, excluding current return; monthly forecast unchanged. Hypothesis: risk acceleration distribution can drift beyond the frozen training distribution, while current shock should not set its own threshold.",986b07b3cbac197fb9f6edeaeefbad7cacb809353720b98d131b43756ce88914,754,0.47076048725288766,0.13761537786287947,0.788385295767753,0.21768925436390418,0.06631299734748011
0084,discard,"Shrunk adaptive volatility gate: average local trailing-history 95/70 thresholds with full-training thresholds, retaining monthly forecast. Same strictly causal local windows as paired adaptive ablation. Hypothesis: pooling stable training estimates with limited recent history reduces noisy threshold drift.",0a0a7feb6803b441e7678126af695cd42ff7b675750cd0b161734779ccb3cf39,754,0.6735613038214427,0.1878044458223762,1.0602269862319023,0.21289549940371533,0.0636604774535809
0085,discard,"Trend-conditioned risk calibration: estimate separate training-only 95/70 volatility-ratio thresholds above versus below SMA200, use currently observed regime to select them; keep pooled thresholds if fewer than 180 observations. Monthly forecast unchanged. Hypothesis: stress distributions differ between trend states.",1a7474bf7cd79c6b242d213d8a521b2ed731ddafb9bde1925f83e34f4a7bf091,754,0.6154731446807666,0.17386301819482064,0.990988918538215,0.2672779853628352,0.058355437665782495
0086,discard,"Forecast-assisted recovery from shock: preserve original exit rule; additionally permit recovery when volatility has fallen below exit threshold, price turns up, and monthly forecast exceeds its training-fitted 90th percentile. Hypothesis: strong expected recovery can justify earlier participation once acute stress decays; threshold uses training only.",c5eb33919114862b8ec8e34e1c1b2f95be0e1b9484ed149e71b3b46fafe02f91,754,0.6715708333807091,0.18733209978381438,1.0570947736526055,0.24183403934859626,0.0636604774535809
0087,discard,"Source Rabiner, February 1989, https://www.cs.ubc.ca/~murphyk/Bayes/rabiner.pdf . Two-state Gaussian HMM: 25 training-only EM iterations on close log returns, filtered-training posterior estimates next-open log-return means with 50-sample prior shrinkage. At each signal forward-filter only current trailing 252 closes; 5bp forecast hysteresis. Hypothesis: persistent latent volatility states can guide invest/cash decisions; no validation smoothing.",24b655c5fa4787a1bd2301c191fef26bf8c40815b3d8f6b99d263de8a606821d,754,0.1856184302443582,0.05855564884231668,0.38009334882608753,0.3223653655578401,0.002652519893899204
0088,discard,"Source Rabiner, February 1989, https://www.cs.ubc.ca/~murphyk/Bayes/rabiner.pdf . Two-state filtered-return model plus acute volatility gate: paired ablation combines HMM conditional return timing with established shock protection. All HMM parameters and conditional returns fitted on training only; inference strictly forward on observed history.",de9750787cfbcb9f50e8215a8b9a3a2a64f0f36312db290ff72ba33644c798d6,754,0.5628803064273582,0.1609496105709105,0.9146181756139186,0.21329247416664254,0.021220159151193633
0089,discard,"Source Rabiner, February 1989, https://www.cs.ubc.ca/~murphyk/Bayes/rabiner.pdf . Three-state Gaussian HMM with acute-risk gate: calm/intermediate/stress variance initialization, otherwise same fixed EM and training conditional-return estimation. Hypothesis: two states may conflate ordinary corrections and extreme volatility; inference uses no future states.",78bc8c27a56c1df1c09074e21ae449123152980903715d1fd7299ace4d39e67e,754,0.5628803064273582,0.1609496105709105,0.9146181756139186,0.21329247416664254,0.021220159151193633
0090,discard,"Source Rabiner, February 1989, https://www.cs.ubc.ca/~murphyk/Bayes/rabiner.pdf . HMM stress-probability gate with existing monthly ridge: replace relative-volatility alarm by posterior probability above .8 for training-fitted highest-variance state, retain low-break confirmation and recover below .5 or SMA10. Hypothesis: persistent probabilistic stress detection is more informative than a ratio threshold; forward filtering only.",a09887b21a2ff349dde784628fe1c1057878587c1a819c4f3b571e2f7c6a7f98,754,0.1532303074513801,0.04880180705872683,0.4273512223738034,0.26420059756495073,0.16445623342175067
0091,discard,"Lasso monthly forecast: L1 coordinate descent with standardized target and inputs, regularization selected by purged chronological training MSE. Same nine close-only inputs and risk gate. Hypothesis: a sparse predictive subset can reduce redundant feature noise. Source Tibshirani 1996 https://doi.org/10.1111/j.2517-6161.1996.tb02080.x .",c4600de1154dfdbce880a2cff824a0497c7d7d5db18a0b96c6dafc2e368c1cbd,754,0.5628803064273582,0.1609496105709105,0.9146181756139186,0.21329247416664254,0.021220159151193633
0092,discard,"Elastic-net monthly forecast: equal L1/L2 mixture, standardized target, training-only regularization selection. Same forecast horizon and risk gate. Hypothesis: combine sparsity with stability when momentum features are correlated. Source Zou/Hastie 2005 https://doi.org/10.1111/j.1467-9868.2005.00503.x .",9beebac546d4f1668aecbd0068cacf8f665e5ccff6b690796f437f43930c916b,754,0.5703842007643527,0.16280960099262254,0.9257964508565059,0.21329247416664276,0.029177718832891247
0093,discard,"Principal-component monthly regression: fit feature covariance and leading orthogonal components on each training subset, select 2/4/9 components by purged chronological training MSE, fixed .1 coefficient damping. Same acute-risk gate. Hypothesis: compress correlated feature directions and discard weak directions rather than individual indicators.",a363443857547f684f2b10ceedfb1d904d156c36fa46702d0718646a885c9917,754,0.6734488608675413,0.18777777266203022,1.0658556313780034,0.21289549940371544,0.07692307692307693
