attempt,status,description,strategy_sha256,days,total_return,annual_return,sharpe,max_drawdown,mean_turnover
0271,discard,"Neural additive predictor: allocate four trainable tanh units to each of the nine individual features and sum their outputs, with no cross-feature hidden connections. Preserve dropout, training-only early stopping, ridge forecast blend and shock gate. Hypothesis smooth nonlinear marginal effects generalize better than unrestricted indicator interactions. Own sparse-architecture comparison; fixed connectivity, no feature or seed search.",2cbacab9c6d0af2058ebdad58472585159e03f30d6f6300d798777282c1f9297,754,0.5370953863624368,0.15451261377418146,0.9082645180367651,0.21289549940371566,0.05570291777188329
0272,discard,"Grouped neural predictor: allocate four tanh units to each of short returns, slow trend, and volatility/drawdown groups; permit interactions within each group but not across groups. Keep original training targets, dropout, purged checkpoint selection, ridge blend and gate. Hypothesis an intermediate structural prior captures economically related interactions while limiting unrelated combinations. Own grouped-architecture hypothesis.",4700a20cf6f199363108e4c9e9a843185ace209c4031916354fb0669fda71f02,754,0.7255395885397653,0.20000887656422606,1.1206004699967038,0.21289549940371522,0.0636604774535809
0273,discard,"State-local neural experts: partition standardized training states into four deterministic farthest-initialized k-means clusters, fit a dropout network per cluster using the globally selected training duration, and shrink the nearest expert toward the global neural prediction by n/(n+500). Original ridge and gate retained. Hypothesis differing conditional return relations across recurring states justify local nonlinear models. All clustering and labels use training only; no random seed search.",c35269f0fb3a6aed2e605b2e8d3cf886068ae46999f6e23abf395a3393378a04,754,0.5127657331166602,0.1483726538600787,0.8816160424866453,0.21289549940371577,0.0610079575596817
0274,discard,"Smooth state-local neural experts: use the same four training-only k-means neural experts but average their shrunken corrections with Gaussian distance weights of bandwidth sqrt(feature_count). Original global model, ridge blend and gate unchanged. Hypothesis smooth transitions among recurring states reduce brittle nearest-cluster switches while preserving local information.",f7c65de80b8e08f473a7b94f1d14c635d892cee575146aca0e20109a96eeeaf7,754,0.6376530075255187,0.17922507375929708,1.032697920461121,0.21289549940371533,0.050397877984084884
0275,discard,"Residual two-layer neural predictor: augment the original8-unit tanh network with a4-unit tanh layer reading those hidden activations and a zero-initialized additive output head. Jointly train both paths with existing dropout/penalties and purged early stopping, preserving ridge and gate. Hypothesis compositions of learned market-state features capture effects inaccessible to a single shallow layer while retaining its direct path. Own architecture hypothesis.",2ce9fbbb8600088a4dfb7c7d73ffa59bc6545d97a971fb1b083f007c46b77e0e,754,0.7456730540309531,0.2046704013501648,1.1379560696903206,0.21289549940371555,0.05305039787798409
0276,discard,"Stacked two-layer neural predictor: use the same8-to4 tanh architecture but remove the direct first-layer output path, forcing predictions through the second-layer bottleneck. Retain original targets, dropout, training-only checkpoint choice, ridge blend and shock gate. Hypothesis a compact composed representation generalizes better than an unrestricted residual correction. Own structural ablation, no width or seed grid.",ce3826032f7b30f222f0d84756935695c88bf1bb5e1d1a449d94981f8c04633e,754,0.7121075407460804,0.1968787653528805,1.0989695302154054,0.21289549940371544,0.05305039787798409
0277,discard,"Fractional-memory features: append three normalized power-decay filters of trailing log returns corresponding to price differencing orders0.75/0.5/0.25, used jointly as a fixed basis. Weights use(j-d)/j recurrence and normalization by current volatility times weight norm. Hypothesis retaining smoothly decaying memory avoids abrupt lookback cutoffs. Original ensemble/gate. Inspiration: Granger and Joyeux (January1980), https://doi.org/10.1111/j.1467-9892.1980.tb00297.x ; finite causal filters only, no asserted stationarity.",7c674c7ba812a7fdfd2829112eedb2d9a8b3742dc337e2a3753a9175cbc06fd5,754,0.7013417429009003,0.1943581542351056,1.0896998984005513,0.21289549940371533,0.05570291777188329
0278,discard,"Fractional-memory momentum replacement: replace endpoint5/21/63-session inputs with the fixed short-to-long fractional filter basis, preserving other features and train-only fitting. Hypothesis a smooth memory profile is a better low-dimensional summary than endpoint returns. Inspiration: Granger and Joyeux (January1980), https://doi.org/10.1111/j.1467-9892.1980.tb00297.x ; finite causal filters only, no asserted stationarity.",3da8fff8407c4dcbf97d60b7546c6791d737972aa5ac7b9c757d94fdb3a2c7ee,754,0.7264088274490339,0.20021087828537754,1.1188352032440116,0.21289549940371555,0.0610079575596817
0279,discard,"Standalone fractional-memory trend: average the three volatility-normalized fractional signals, enter above0.1 and exit below-0.1, retaining position between thresholds and applying the original training-calibrated shock gate. Hypothesis multi-rate long memory yields a stable directional rule without supervised fitting. Inspiration: Granger and Joyeux (January1980), https://doi.org/10.1111/j.1467-9892.1980.tb00297.x ; finite causal filters only, no asserted stationarity.",30aedf4c7a92407dd3a9c763b07f40d0078364cdd812b0d533be69bbe9ec310c,754,0.004573943703101158,0.0015263703275045781,0.07696783714287432,0.26177197504009,0.17771883289124668
0280,discard,"Drawdown-energy shock gate: replace short/long return volatility ratio with the ratio of5/60-session root-mean-square pullbacks from each observation's trailing20-session price high. Preserve train95/70 calibration, price confirmations and original ridge/dropout forecasts. Hypothesis persistent downside path stress is more relevant to avoiding losses than volatility from upward moves. Own causal path-risk hypothesis.",13bab1cb7d62dcde8b0523263db7609454f60c4072433472fb8c0e46fceef70d,754,0.5308652667374669,0.15294654673667418,0.8855675401247387,0.2758153598784534,0.05570291777188329
0281,discard,"Duration-normalized drawdown gate: use log decline from the126-session high divided by trailing60 volatility times square root of sessions since that high. Preserve original train-quantile thresholds, exit confirmation, recovery logic and ensemble. Hypothesis unusually fast declines relative to their duration identify harmful states without treating all high-volatility moves alike. Own price-path hypothesis.",ca4b148f56bb75b2f04102addc9504d1ded06d8501f8b8acc197ad9efcb20aff,754,0.3417552538030544,0.10324166108359889,0.6705701813494586,0.33866450144134075,0.07161803713527852
0282,discard,"Drawdown geometry features: append trailing126-session maximum pullback, RMS pullback, age since high and fraction of observations more than one current daily-volatility unit underwater. Normalize magnitude features by current volatility and sqrt126. Original training-only ensemble and shock gate unchanged. Hypothesis depth, duration and persistence jointly describe market states beyond current distance to a recent high. Own feature hypothesis.",cdee230fafb522102e369db9278cd6b7df539bd07976f8b29fafc84b2d9c1874,754,0.6668319249931067,0.1862060301443884,1.0429590101761121,0.21289549940371544,0.05570291777188329
0283,discard,"Log-volatility representation: log-transform current20-session volatility and the5/20 volatility ratio in both predictors; keep all directional features, original gate and training-only model selection unchanged. Hypothesis compressing the positive risk scale represents proportional changes more consistently across volatility regimes. Own feature-coordinate hypothesis.",770856c2f144169502dd2bc2b5703f1f475e75b2ade3f752cd16ef9e486fb2e7,754,0.6390089730565918,0.17955131059479146,1.029430342706514,0.21289549940371577,0.05570291777188329
0284,discard,"Volatility term structure: append log20/60 and60/126 volatility ratios plus lag-one squared-return dependence to both predictors. Hypothesis short-lived shocks and persistent multi-horizon risk states have different conditional returns. Original training-only fit and gate retained. Horizon-component inspiration: Corsi (Spring2009), https://doi.org/10.1093/jjfinec/nbp001 ; daily close-return adaptation, not intraday HAR-RV replication.",313657aadd76dfb60726abc7b730a41bbc3da36d8ec2c0c62ff15a974c8f9d77,754,0.6006420146329787,0.17025014137613992,0.9612539986242638,0.21329247416664388,0.03978779840848806
0285,discard,"Rolling relative-volatility context: append the current20-session volatility percentile and log ratio to its median among all20-session windows in the available252-session history. Hypothesis current risk relative to the observable recent environment transfers better than its absolute level alone. Original features, training-only fits and gate retained; no future or external distribution statistics.",48d55562e39d869e10c118184af7816cea154aa9eab105c0a522d6ffcc6b6c81,754,0.6814677597090832,0.18967699231559942,1.0654638471208657,0.212895499403716,0.050397877984084884
0286,discard,"Adjacent-state prediction consistency: train each minibatch on16 pairs of neighboring training observations and penalize squared differences between their dropout neural forecasts with relative coefficient0.1, alongside the original supervised errors. Pairing stays within each fitting prefix; purged checkpoint evaluation remains clean MSE. Original ridge and gate unchanged. Hypothesis monthly expected return should vary smoothly across nearby daily states, reducing unstable signal switches.",423bfe1beaa3b1267db192ec8f01774babcbbe230a134da28a1d3de04f07f8f7,754,0.7001446464684229,0.19407722101008562,1.0890113608562928,0.2128954994037161,0.04774535809018567
0287,discard,"Adjacent-state change supervision: use the same paired training procedure but match predicted forecast changes to differences between the two monthly training targets instead of forcing them toward zero. Original ridge, dropout, clean purged early stopping and gate retained. Hypothesis learning changes as well as levels improves sensitivity to evolving return opportunities without shrinking every change. All difference labels remain inside training.",101adbb491f53bd044d427fb2ffce1e89c87aa1f9621841f080ac19c429e153f,754,0.7623861518785386,0.20851288886061092,1.162334723385403,0.21289549940371588,0.05570291777188329
0288,discard,"Factorization-machine forecast ensemble: replace tanh prediction with a linear term and rank-three pairwise feature interactions, initialized near ridge and trained with input dropout and squared loss. Select200/600/1200 steps on the same purged training suffix; retain equal ridge blend and shock gate. Hypothesis low-rank interactions share parameters more efficiently than dense quadratic features or hidden tanh units. Factorized-interaction inspiration: Rendle (ICDM2010), https://www.libfm.org/ ; independent standard-library implementation.",f17f2977d77373ea9d8b0bde928a426ef4155ee3bef4361d21219c7db292c099,754,0.5827650931929274,0.16586555986048923,0.9572043206307386,0.212895499403715,0.04774535809018567
0289,discard,"Standalone factorization-machine allocation: use the same training-only low-rank interaction predictor directly for the existing hysteretic long/cash decision, preserving the original shock gate. Hypothesis the model's learned linear term already supplies the ridge-like baseline and an extra equal ridge blend dilutes useful interactions. Factorized-interaction inspiration: Rendle (ICDM2010), https://www.libfm.org/ ; independent standard-library implementation.",b994cc93ecd1487c4857823ee471c876b5f4b421ecc3adfd4a3b5a055ef7c296,754,0.442737509545174,0.13032462778288978,0.8002075921556405,0.20109786147239284,0.05305039787798409
0290,discard,"Training-only symbolic policy discovery: evolve32 small causal expressions for10 generations using current technical features and add/subtract/multiply/negate/tanh, bounded to25 nodes and depth5. Fit on first70-percent training data with2-row purge, select generation2/5/10 champions on later training net growth, enforce training drawdown50-percent and charge trading costs. Deploy selected expression with0.05 score hysteresis and original shock gate. Hypothesis compositional rules express useful interactions missed by fixed predictors; validation used only by official runner.",3bb5bbfa693d9f70ba1717369d2538f8546a1a202e7a2567fd1ecd0986389b9c,754,0.5171439960158395,0.14948240152615466,0.8839598665030186,0.21289549940371555,0.03713527851458886
0291,discard,"Ungated symbolic policy discovery: apply the identical fixed-seed, bounded expression-fitting procedure directly to long/cash positions without the shock overlay in either training or deployment. Hypothesis a jointly learned nonlinear rule may incorporate risk information more effectively than multiplying by a fixed independent filter. All program search and checkpoint choice remain inside training; unchanged official reward and execution.",2f0a8680aab484ec64934f5b30448069fe621e602d9c4e9e542d705de8412e8d,754,0.150922355098825,0.048099829915934755,0.33525244657997694,0.3223653655578401,0.01856763925729443
0292,discard,"Deterministic symbolic-search correction: Training-only symbolic policy discovery: evolve32 small causal expressions for10 generations using current technical features and add/subtract/multiply/negate/tanh, bounded to25 nodes and depth5. Fit on first70-percent training data with2-row purge, select generation2/5/10 champions on later training net growth, enforce training drawdown50-percent and charge trading costs. Deploy selected expression with0.05 score hysteresis and original shock gate. Hypothesis compositional rules express useful interactions missed by fixed predictors; validation used only by official runner. Add a canonical expression-string tie-break after equal training reward and size, ensuring set/hash iteration cannot change the evolutionary parent ordering. Earlier archives retained.",c42fdcc04f5d261b0ba5a767c53a673d9509eb0ce7a57e2fb70f802a5001b5d6,754,0.5171439960158395,0.14948240152615466,0.8839598665030186,0.21289549940371555,0.03713527851458886
0293,discard,"Deterministic symbolic-search correction: Ungated symbolic policy discovery: apply the identical fixed-seed, bounded expression-fitting procedure directly to long/cash positions without the shock overlay in either training or deployment. Hypothesis a jointly learned nonlinear rule may incorporate risk information more effectively than multiplying by a fixed independent filter. All program search and checkpoint choice remain inside training; unchanged official reward and execution. Add a canonical expression-string tie-break after equal training reward and size, ensuring set/hash iteration cannot change the evolutionary parent ordering. Earlier archives retained.",63eb446eae683c68adfbbe5e5d470f59b3fa23cfa5b686a4a05af8aec89b6d45,754,0.150922355098825,0.048099829915934755,0.33525244657997694,0.3223653655578401,0.01856763925729443
0294,discard,"Conditional Gaussian-noise neural fit: add a learned log-variance head to the8-unit dropout predictor and jointly optimize Gaussian likelihood, with log variance clipped[-2,4] and learning rate0.01. Continue selecting training checkpoints by clean mean-prediction MSE; deploy only the mean in the original ridge/gate ensemble. Hypothesis learned input-dependent uncertainty discounts noisy training targets more effectively than a fixed volatility weight. Inspiration Nix and Weigend (1994), https://doi.org/10.1109/ICNN.1994.374138 .",89b1829441f3609a4ddec3ec03347dbff57c8702a98dcb85bd1d871e8508ce4f,754,0.692917769182493,0.19237842208856137,1.0766070881669167,0.21289549940371555,0.04774535809018567
0295,discard,"Conditional Student-t neural fit: replace Gaussian likelihood with a fixed4-degree-of-freedom Student-t likelihood while jointly learning location and log scale. Same dropout architecture, rate0.01, scale bounds, purged mean-MSE selection and original mean-based allocation. Hypothesis heavy-tailed target noise should reduce extreme-label influence without discarding conditional uncertainty modeling. Own robust-likelihood extension of the mean/variance-network idea.",f918863fb278903b9670ac7ab0535edacd28a901aa1e0c9606daa70b72dba51a,754,0.6471520310516439,0.18150670934887225,1.0217934992120223,0.21329247416664276,0.03183023872679045
0296,discard,"Recency-weighted neural learning: weight monthly-target neural squared errors with a504-observation exponential half-life, mean-normalized within each fitting prefix. Keep original global normalization, dropout, unweighted later-training MSE checkpoint selection, full-history ridge and shock gate. Hypothesis the nonlinear return relation changes over time, so recent labeled states should receive more training influence. No calendar rules or validation fitting.",943a3d03bb639f14851fca9a809e9c56dd75f0a04d261b3f87f72dd7a2282a6a,754,0.581495681308255,0.1655529664986053,0.9645433922082833,0.21289549940371566,0.05570291777188329
0297,discard,"Long/short training-memory neural ensemble: average two dropout predictors fitted separately to all training rows and the most recent756 rows, each selecting duration on its own purged70/30 chronological split. Preserve the original full-history ridge and shock gate. Hypothesis averaging broad historical structure with recent-state adaptation balances estimation variance and parameter drift without selecting a single window from validation.",2900b835ff2682e6e29d209d3c28afb6e1d12f129415c34e9bc7337b20fa5c12,754,0.6222608661444864,0.17550914931296058,1.0095515405633968,0.21289549940371555,0.05305039787798409
0298,discard,"Piecewise-linear neural response: replace bounded tanh hidden units with rectified linear units and matching derivatives, retaining width8, dropout, fixed initialization scale, training-only checkpoint selection, ridge blend and shock gate. Hypothesis a piecewise-linear forecast can respond to extreme standardized indicator states instead of saturating. Own activation-family comparison, no activation parameter search.",a89814a3d1393dff8988dfc55d2de87c6d0e08c9c795698cd373e299dfb4312f,754,0.6653788043292439,0.1858603095345861,1.058290958742431,0.21289549940371544,0.05305039787798409
0299,discard,"Chronologically cross-fitted residual network: generate monthly residual targets from ridge0.1 models trained strictly before three later training folds with21-row purges, then fit dropout neural correction on those out-of-sample training residuals. Select neural duration on a further purged chronological residual split. At inference add correction to full-training ridge0.1, then retain original equal blend with tuned ridge and shock gate. Hypothesis realistic baseline errors support a more complementary nonlinear correction than in-sample residual learning.",54be20ec059e8f111e92d0011a38413562f4072084884380e00da2808bdb596d,754,0.5037619563674514,0.1460837499941483,0.873574941631495,0.20109786147239272,0.05570291777188329
0300,discard,"Feature-support forecast shrinkage: estimate the95th-percentile squared standardized-feature radius using training observations. Beyond it, shrink the ensemble forecast toward its training unconditional mean in inverse proportion to excess radius; within it retain original forecasts. Preserve original hysteresis and shock gate. Hypothesis fitted conditional-return signals should be trusted less far outside their typical training inputs. Support calibration uses features only.",90bf10edb53b91f770663d21502103a8e2150777736ae3d65fb31d5e8f52efe3,754,0.7922187114419117,0.21531178867112644,1.1854366244389538,0.2128954994037151,0.05570291777188329
0301,discard,"Local-support forecast shrinkage: retain every20th training state as a reference bank; calibrate95th-percentile nearest-reference distance while excluding references within20 rows of each calibration observation. Shrink forecasts toward the training mean only beyond that support distance. Original predictor fits, hysteresis and gate retained. Hypothesis local support geometry is more informative than distance to the global center; all calibration stays in training.",02445b9e9118a388ec9ddeab6bee432f7c391b36fba5dfd6db755a9310e0af20,754,0.7896312730793251,0.21472510398898303,1.1884702444921593,0.21289549940371533,0.058355437665782495
0302,discard,"Supertrend directional rule: compute causal WilderATR10 with3-ATR carried bands across the available252 OHLC bars, then hold the index only in the upward state with the existing shock gate. Hypothesis volatility-adjusted trailing bands capture trends differently from moving-average or endpoint rules. Formula reference TradingView, publication date unstated, accessed2026-09-16: https://www.tradingview.com/support/solutions/43000634738-supertrend/ .",019bc50e7b61526f98aa541d395237adccde5f21257cba7f6c99c02c4a54f364,754,0.05824567722377716,0.019101028218821536,0.22333519803266283,0.16845702161691278,0.042440318302387266
0303,discard,"Supertrend state features: append trend direction, signed distance to active band in ATR units and fraction of the last20 upward states to the original ridge/dropout inputs. Retain training-only fitting and original gate. Hypothesis a path-dependent trailing-band state complements instantaneous momentum features. TradingView formula reference, undated, accessed2026-09-16: https://www.tradingview.com/support/solutions/43000634738-supertrend/ .",c9a7427f223243d883f74e65d1c4745911a41f8ef4ad3d65ed5540d56eb43b2c,754,0.6574715386710943,0.18397551622293196,1.0360072895447539,0.21289549940371544,0.05305039787798409
