attempt,status,description,strategy_sha256,days,total_return,annual_return,sharpe,max_drawdown,mean_turnover
0134,discard,"Episode trailing-stop overlay: original monthly ridge plus shock gate, track close-price peak during positive allocated episodes and stop at peak minus 3 ATR22. Reentry requires exceeding prior ten closes. Hypothesis protect accumulated trends when relative-volatility gate misses gradual reversals. Peaks are causal close observations, never future/execution prices; no intraday stop-fill assumption.",2674adcb095bf09bc40e28a6c5db46116146634f498361634643aedd15ebab08,754,0.17163665359108204,0.054367008236872794,0.4717679587652456,0.265524874388136,0.08753315649867374
0135,discard,"Conditional-noise weighted monthly ridge: weight training rows by inverse trailing-20 variance, cap relative weights at 0.1 to 10 times median, refit exact weighted intercept and covariance. Same close-only features, purged training MSE ridge selection, shock gate. Hypothesis noisy high-volatility examples should have less coefficient influence; weights use only contemporaneously known input volatility.",d15b7788f51dbca200e7ab25ebceb0e2987d41dcec2915ef09178658a59c88f5,754,0.5866932541788468,0.16683181545713066,0.9468741406467,0.21329247416664254,0.023872679045092837
0136,discard,"Robust monthly Huber regression: 12 IRLS iterations, residual cutoff 1.345 times training target standard deviation, exact weighted intercept, same ridge candidates selected by purged training MSE and original shock gate. Hypothesis residual outliers after conditioning distort coefficients; unlike label winsorization, weight depends on model error.",ee35e89c5df39484efffa67e61b52a10bd19fbcaa586d92423e566af51a927f8,754,0.6841077001625628,0.19030092394183074,1.0673011730496407,0.21329247416664265,0.04509283819628647
0137,discard,"Approximate conditional-median monthly regression: 12 IRLS iterations with inverse absolute residual weights floored at 5% of training target standard deviation, exact weighted intercept and ridge regularization. Purged train MSE selects ridge; same close features and shock gate. Hypothesis robust central monthly drift gives cleaner signs than the mean; no validation fitting.",c45390677f2912425c64eca6e3dd85219fa1614154fc3c31a16ca1620535edad,754,0.5628803064273582,0.1609496105709105,0.9146181756139186,0.21329247416664254,0.021220159151193633
0138,discard,"Training-only grouped feature selection: evaluate all seven nonempty combinations of short-return, long-trend, and volatility/drawdown groups, jointly select subset and ridge by purged late-training monthly-target MSE. Refit chosen subset on all training; unchanged risk gate. Hypothesis redundant feature groups hurt forecast stability.",3ea66ef2c472af8bf16f717d5d0e982e75190ddca185253604edbc221904cae8,754,0.46963321449000195,0.13732388860764355,0.8240041321037889,0.21289549940371633,0.04774535809018567
0139,discard,"Training-only grouped feature selection by trading return: same seven predetermined group subsets and ridge choices, selected by exact net log growth on purged late-training rows with prefix-calibrated shock gate and 50% drawdown cap. Hypothesis subset useful for returns may differ from MSE-optimal subset. Final validation only via runner.",fd2c575a08b06175e4a60a6d63937d118cc138cdab16cf550195c5495bc44ba7,754,0.5901689608535488,0.16768544842087696,0.9513141517785457,0.2132924741666422,0.026525198938992044
0140,discard,"Training-only forward feature selection: greedily add one of nine close-only predictors only while purged late-training monthly MSE improves, selecting ridge within each subset. Refit final subset on all training; fixed shock gate. Hypothesis a compact supervised subset avoids correlated noisy dimensions without lasso shrinkage bias.",a267691c8cbf0bd340d254839e95407c09a1d016ae01d2e7b15b0cc9f38f249f,754,0.4132121155839301,0.12254026182927014,0.7505158394716895,0.21289549940371555,0.03978779840848806
0141,discard,"Conditional monthly regressions by volatility state: split training rows at training median trailing-20 volatility, fit separate close-only ridge forecasts, blend current-state model 50% with pooled model. Every CV fold learns its own threshold and regressions; purged training MSE selects ridge. Hypothesis normalized predictors still have volatility-dependent return relationships; unchanged shock gate.",932e1ef546893ffc6486e1d388b8fdd937aae93f593fdd6f3a10425d5165dbb1,754,0.587476341797222,0.1670242502076631,0.9662354622988227,0.2128954994037161,0.06631299734748011
0142,discard,"Joint volatility/trend conditional monthly regressions: four train-defined groups from median trailing volatility and close above/below SMA200. Shrink each local forecast toward pooled prediction by n/(n+500), minimum 80 group samples; purged training-only ridge CV. Hypothesis bear/bull volatility interactions need separate slopes rather than a shared global linear fit.",a32b39e6820c1ae9461efe92938ee33193327b89de2b61fe003447f03aefc6b0,754,0.6104490316971389,0.17264162235739655,0.9932132368343558,0.2132924741666431,0.0610079575596817
0143,discard,"Smooth volatility mixture of monthly regressions: fit three training volatility-tercile experts; blend experts with Gaussian distance to each train median, width training volatility standard deviation, then average with pooled forecast. Train-only purged ridge CV and same shock gate. Hypothesis continuous regime weights reduce abrupt state-switch errors.",1fa396eccba515d566e9e5ed20549844eeafb6e4c89af24fdae72dfec48913d1,754,0.4892407911863754,0.142372935290342,0.8494187437337466,0.21289549940371544,0.042440318302387266
0144,discard,"Causal state-velocity features: append five- and twenty-session differences of all nine close-only features, computed from truncated histories entirely within the 252-row observation. Hypothesis direction of change in trend/volatility state matters beyond current levels. Same monthly labels, purged training ridge CV and shock gate.",37eddfc6bcdcfc71f8b63af5354ea6555c5e884bb1ef80c338bd1b584c6b1ea9,754,0.5800319327971202,0.16519231019926361,0.9531670517363807,0.21289549940371588,0.0610079575596817
0145,discard,"Temporal cosine return features: append four fixed discrete-cosine projections (frequencies 1,2,4,8) of last twenty volatility-normalized log returns. Hypothesis recent ordering and oscillation phase carry information that aggregated momentum ignores. Deterministic past-only basis, monthly ridge with purged training CV and unchanged gate.",95ac9f9f061a59937c7655ba0578e646a632569b2eabcba25d13303a6ed1b663,754,0.6850455420012442,0.19052241959902383,1.076106409922799,0.21289549940371566,0.0610079575596817
0146,discard,"Fixed nonlinear temporal filters: append eight outputs of causal two-state tanh recurrences over last sixty normalized returns, using predefined fast/slow decay and positive/negative feedback pairs. Hypothesis low-dimensional sequence memory captures reversal patterns unavailable to static random features. No fitted recurrent weights, monthly readout ridge selected only on purged training; original shock gate.",a7f96ac70704248449983a76e758333beadcdbc99ff43cb51fa4f24ed487ae24,754,0.7083605357336797,0.19600267426406548,1.1043080571458013,0.21289549940371533,0.06631299734748011
0147,discard,"Out-of-fold daily payoff calibration: three expanding training folds generate monthly-model forecasts without label overlap; fit regularized two-parameter affine map from forecast to realized next-open daily log return. Final monthly base refits all training; frozen calibration drives same hysteresis/gate. Hypothesis monthly conditional drift requires execution-horizon calibration, distinct from correcting monthly forecast residual mean.",bb5ed4c513adc9182b55aa60d1132a62f6398033e38a816bd987bd5a96b1f159,754,0.5628803064273582,0.1609496105709105,0.9146181756139186,0.21329247416664254,0.021220159151193633
0148,discard,"Out-of-fold binned daily payoff calibration: three expanding purged training folds, five equal-count forecast bins, shrink each daily log-return estimate toward training OOF mean by 100 pseudo-observations, interpolate and clamp outside centers. Hypothesis forecast magnitude and daily payoff relation is nonlinear. Final refit, same gate; all calibration labels training-only.",bf0ee6465e2a8ab5051ffa335461ff1b21751667b1f09330b061d4c5fdea3c62,754,0.48729024807547683,0.14187265063521526,0.848958381031746,0.2515091378722595,0.08753315649867374
0149,discard,"Out-of-fold monotone daily payoff calibration: ten equal-count training forecast bins with 100-mean pseudo-observations each, weighted pool-adjacent-violators enforces monotonicity, interpolate/clamp. Three expanding purged training folds and final full-training base refit. Hypothesis preserve forecast order while reducing noisy daily payoff mapping; unchanged gate and position threshold.",1f921d74f2abeba6ebbe31c8355f69f3333777c72642cf2017ef1e9bc27fb528,754,0.5628803064273582,0.1609496105709105,0.9146181756139186,0.21329247416664254,0.021220159151193633
0150,discard,"Direct recurrent allocation policy: sigmoid of nine standardized close features plus prior latent allocation; exact forward sensitivities through recurrence, weight drift, turnover and terminal liquidation optimize annualized net log growth. Purged late-training return selects penalty and 100/300 steps; no leverage, no risk gate. Inspired by Moody/Saffell July 2001 https://people.idsia.ch/~juergen/rnnaissance2003talks/MoodySaffellTNN01.pdf ; adapted simple recurrent model, hypothesis memory improves transaction-aware policy over feedforward baseline.",db65d9f6e7174aab476f08de27eb93ba1a7b1efd5ffadae681b5c79a83e6c17f,754,0.174665333329465,0.05527714793968008,0.3779393590569788,0.30367196265914564,0.0066352273807085615
0151,discard,"Direct recurrent allocation with integrated shock gate: same causal sigmoid-memory policy and exact forward gradient of net log growth, but multiply allocations by train-calibrated shock gate inside training objective and training CV as well as inference. Prefix training alone calibrates CV thresholds. Hypothesis jointly learning exposure around risk-off states outperforms applying gate only after optimization. Moody/Saffell July 2001 https://people.idsia.ch/~juergen/rnnaissance2003talks/MoodySaffellTNN01.pdf ; adapted recurrent direct policy.",ac78896184138dcf1f6ac5ef3e1408ee150e7159639cad4b537481435fe0b488,754,0.5184608891858462,0.14981577406001612,0.9200174899132602,0.19546533588243886,0.022861640723501313
0152,discard,"Rule-based trend/oscillation switch: ADX14 above 25 follows positive-vs-negative directional movement; below 20 buys CCI20 below -100 and exits above zero; intermediate state retains position. Own combined hypothesis, conventional fixed thresholds, causal OHLC only, next-open execution. Indicators: Fidelity DMI/CCI guides, undated accessed 2026-09-15, https://www.fidelity.com/learning-center/trading-investing/technical-analysis/technical-indicator-guide/DMI and https://www.fidelity.com/learning-center/trading-investing/technical-analysis/technical-indicator-guide/cci .",4243c249d81274fd06ec43ca213ef4af9fde39345a52e213755f8257d1e51a00,754,-0.1860457796835906,-0.0664857581792827,-0.6041116329238787,0.28470669694845285,0.0610079575596817
0153,discard,"Monthly ridge with directional-movement context: append DI14 spread, ADX14 strength and their interaction to original close-only model. Hypothesis high/low trend persistence adds information beyond close trend slopes. Same purged train ridge CV and shock gate. Indicators: Fidelity DMI/CCI guides, undated accessed 2026-09-15, https://www.fidelity.com/learning-center/trading-investing/technical-analysis/technical-indicator-guide/DMI and https://www.fidelity.com/learning-center/trading-investing/technical-analysis/technical-indicator-guide/cci .",06c78c7a2160012f56ff735f4220e9da3f814326db27f1b6369f2ae9da389bdb,754,0.7157380283965897,0.1977263966218996,1.1113099667344102,0.21289549940371555,0.0610079575596817
0154,discard,"Monthly ridge with trend-conditioned oscillator context: add DI spread, ADX strength, signed trend strength, CCI20, five-session CCI change and CCI-times-ADX. Hypothesis an extreme oscillator can mean continuation under strong trend and reversal otherwise; learned only from training, fixed model protocol. Indicators: Fidelity DMI/CCI guides, undated accessed 2026-09-15, https://www.fidelity.com/learning-center/trading-investing/technical-analysis/technical-indicator-guide/DMI and https://www.fidelity.com/learning-center/trading-investing/technical-analysis/technical-indicator-guide/cci .",81bf71937ae5f00f0aca7b55cfbd9681f4cdc22469b654038d1a4414d022e91a,754,0.7172771501565218,0.19808538399364006,1.112429224895115,0.21289549940371566,0.0636604774535809
0155,discard,"Derivative-free binary policy learning via cross-entropy method: diagonal Gaussian population32 elite8, fixed seed, optimize exact cost-adjusted log growth with 50% drawdown constraint. Nine standardized inputs, fixed +/-0.25 signal hysteresis; late purged training selects 10/20/30 generations then refit. Hypothesis direct search avoids sigmoid-gradient near-full-investment plateaus. No risk gate. Inspired by de Boer/Kroese/Mannor/Rubinstein 2005, https://people.smp.uq.edu.au/DirkKroese/ps/aortut.pdf .",86b4a0aad36d881a81e94709d1a985044669a5b96401ebc29cda92eeed4a2213,754,0.0888157483955394,0.028847023182871023,0.2434733295477165,0.29948564932133337,0.03978779840848806
0156,discard,"Cross-entropy binary policy learning with integrated shock gate: same deterministic population search and exact net-growth objective, multiply positions by prefix-trained shock gate in fitting, training CV and final inference. Hypothesis discontinuous entry/exit plus risk-off structure benefits from derivative-free optimization; final validation never accessed during policy fitting. Inspired by de Boer/Kroese/Mannor/Rubinstein 2005, https://people.smp.uq.edu.au/DirkKroese/ps/aortut.pdf .",47ce7ce3bc585105bb6cf07615e99d0d9b88bd37b26189a5a7cf113fae4b9074,754,0.17350139944315401,0.054927562612624437,0.42971504910490416,0.2010978614723925,0.04509283819628647
0157,discard,"Training-only stacked forecast horizons: 1/5/20/60-session ridge models generate three expanding-fold OOF predictions; each base model chooses ridge on its own purged prefix. Choose among 35 convex quarter-step mixtures by OOF monthly-target MSE, refit full training. Hypothesis learned horizon mixture improves on prior equal weekly/monthly/quarterly blend. All stacking labels training-only; unchanged shock gate.",0c90254b570ad6064b471aa2b254b16035874517f05146f69e80890b385a3b7e,754,0.6294556477751574,0.17724900029038904,1.0018824362649148,0.21329247416664265,0.03183023872679045
0158,discard,"Return-selected training-only horizon stack: same four purged nested ridge forecasts and 35 convex mixtures, choose mixture by exact daily net log growth with prefix-calibrated shock gate on three OOF training folds, including turnover, fold liquidation and drawdown cap. Hypothesis forecast horizon weights should reflect trading payoff rather than target MSE; full-training refit then fixed validation inference.",c386e51838dfa2dc639fd84a67adf13b464ef943072fdfc717bf9fbbbd262e4f,754,0.5628803064273582,0.1609496105709105,0.9146181756139186,0.21329247416664254,0.021220159151193633
0159,discard,"Arithmetic daily-payoff forecast with explicit volatility drag: fit monthly average of simple daily forward returns instead of log returns, then subtract half contemporaneous daily variance before allocation to approximate geometric drift. Same nine causal close features, purged train ridge CV, hysteresis and shock gate. Hypothesis separating conditional arithmetic payoff and known variance drag avoids their confounding in one log-return regression; approximation, not exact utility.",32a209937ce173bae84bab40274cd38f64d2dd0726adb0fcd4345698aeec27db,754,0.5153163465093455,0.1490194112438561,0.9160610501621941,0.21289549940371566,0.0636604774535809
0160,discard,"Compounded monthly-payoff target: ridge learns realized 20-session compounded simple return divided by 20, converts predicted horizon payoff back to per-session log scale for allocation. Same model and purged training selection. Hypothesis expected holding-period wealth weights strong trends differently from averaging daily log rewards; final ranking still exact frozen net CAGR.",4b593d039f4ab344594b0f0928b8afd948c01dd84ce70f332b6b976b0be796dc,754,0.7104492013260435,0.1964911849351163,1.1009689734288977,0.21289549940371588,0.05570291777188329
0161,discard,Path-risk-adjusted monthly training target: subtract half within-future-window daily log-return variance from mean monthly log drift when constructing training labels. Variance is training-label information only and is never computed from future observations at allocation. Hypothesis penalizing unstable training return paths yields more reliable positive forecasts while preserving original position/risk execution.,f7ae19db5d4ba7db94184c83757d455202476b3b484254cc4287abb1fb460a57,754,0.7006806258414648,0.1942030203148044,1.0957197097041786,0.21289549940371533,0.0636604774535809
0162,discard,"Nonoverlapping shock baseline: compare fast last-five return volatility with preceding sixty returns excluding those five, instead of overlapping 5/60 windows. Relearn 95/70 percentile thresholds solely on training; same monthly predictor and price/recovery rules. Hypothesis fast shocks should not simultaneously inflate their own reference volatility.",b8ca79c984bc43f4b2c050248fa5a93546dba7a54be4c49688ca6955f2a3b460,754,0.6699370048642881,0.18694410628063518,1.0539992585204734,0.2376757745252721,0.058355437665782495
0163,discard,"Robust pre-shock baseline: last-five standard deviation divided by 1.4826 median absolute deviation of preceding sixty returns, floor .001; train calibrates same 95/70 quantiles. Same monthly predictor and gate transition rules. Hypothesis historical isolated extremes mask new shocks in standard-deviation reference; robust reference resists that masking.",bf4eda8c44cc29a3a6a8b90887d1b51d7c65984b85e345d68e23d1d22c2f78d3,754,0.5675388946052504,0.16210503282142996,0.9323180104228824,0.2672779853628362,0.058355437665782495
0164,discard,"Slower forecast feature normalization: use contemporaneous sixty-session close volatility in the nine predictor normalization terms and volatility feature rather than twenty-session volatility, retain five-session numerator and original independent shock gate. Hypothesis month-ahead forecasts need a more stable risk scale; all model fitting and ridge selection remain purged training-only.",4d88721e5eb2d71cde2796782ade17975beb1e2a583b5c434643a128ad640200,754,0.5755483605048493,0.16408620657054818,0.934217679404998,0.21329247416664232,0.023872679045092837
0165,discard,"Local residual correction to monthly ridge: retain global forecast then add Gaussian-distance weighted training residual mean from 100 nearest standardized training states, shrunk by 100 zero-residual pseudo-observations. Unlike earlier raw-neighbor averaging, preserve global trend slopes and correct only local bias. Purged training CV refits entire model for each ridge; unchanged shock gate.",5462d0d9b8e0d98c33c0eed188a717801f89b45310d96c0747ffa469adc75c7b,754,0.6570825134605915,0.18388263294812401,1.0489209134452504,0.21289549940371533,0.058355437665782495
0166,discard,"Query-local linear monthly forecasting: 256 nearest standardized training states, Gaussian distance weights, exact local weighted intercept and ridge1 slopes, average with globally fitted forecast. Hypothesis conditional slopes need smooth multivariate locality beyond hard volatility/trend groups. Global ridge chosen by purged training MSE of combined predictor; local data always training-only, unchanged shock gate.",487b1b66624d433dcfbcf2c24ba8a16c1c89aa362f0123ad065f86e2389060a8,754,0.6805926146050272,0.18947001390827212,1.0744624140580834,0.21289549940371522,0.05570291777188329
0167,discard,"Purged delete-block monthly ensemble: eight deterministic contiguous training blocks, each member omits one block plus preceding 19 overlapping target starts; average forecasts. Ridge chosen using same purged chronological inner training fold. Hypothesis delete-block aggregation is less noisy than earlier moving-block bootstrap while reducing dependence on individual market episodes; original close features and shock gate.",254f613faacd00e310c177ae541c1b5de1b354db8be6b034a1e70939a6057c94,754,0.7125010130200016,0.1969706894196519,1.1071232297549938,0.212895499403716,0.0636604774535809
0168,discard,"Robust median delete-block monthly ensemble: same eight purged leave-block-out training regressions, median forecast rather than mean. Hypothesis a few influential training episodes distort signs and median aggregation resists them. Train-only chronological ridge CV, unchanged features, hysteresis and shock gate.",2ff30a40b673252d32126fa67636758b5fa04bf0809eef9f5999a5f820b5e07e,754,0.716312906794212,0.19786050731082838,1.1119531558000026,0.21289549940371522,0.0636604774535809
0169,discard,"Variance-clock training horizon: average future training log returns over round(20*(1%/current-vol20)^2) sessions, bounded 5 to 60. High-volatility states use shorter forecasts and low-volatility states longer; omit final59 rows and purge61 before internal CV. Fixed reference volatility, no validation fitting. Hypothesis constant risk-time target is more stable than fixed monthly calendar horizon; original execution gate/hysteresis retained.",15ae9cffdacbf9d9036898ccb87f362f1a90bd993e9669bedc4b4e5529c51f6b,754,0.5660943865704007,0.16174701100899114,0.9290223130280248,0.21329247416664265,0.03978779840848806
